id,speaker,speech,context,raw-dialouge,season,episode,title,airdate,runtime
15662,Sandy,I'm alive? And the treedome's full of air? And sort of dry? How'd you fellers pull it off?,,I'm alive? And the treedome's full of air? And sort of dry? How'd you fellers pull it off?,09,27,Bubble Troubles,26-Nov-11,10
15663,SpongeBob,"Oh, you could say we had a little help from a big bubble. ",SpongeBob and Patrick both snicker,"Oh, you could say we had a little help from a big bubble. [SpongeBob and Patrick both snicker]",09,27,Bubble Troubles,26-Nov-11,10
15664,Sandy,"Hmm... In case you forgot, it was bubbles that got us into this mess in the first place. I don't want you blowing anymore bubbles around my house.",,"Hmm... In case you forgot, it was bubbles that got us into this mess in the first place. I don't want you blowing anymore bubbles around my house.",09,27,Bubble Troubles,26-Nov-11,10
15665,SpongeBob and Patrick,Uh-oh. ,Sandy's house begins floating in the giant bubble,Uh-oh. [Sandy's house begins floating in the giant bubble],09,27,Bubble Troubles,26-Nov-11,10
15709,Mr. Krabs," Please be money, please be money.  Oh! That's not money. It's from SpongeBob.  ""Dear Mr... Krabs, please come to my house tonight. I am having a free money party."" Free money party!? This sounds too good to be true!","With his eyes closed Pulls out postcard from mailbox. Puts on his glasses, and reads the postcard","[With his eyes closed] Please be money, please be money. [Pulls out postcard from mailbox.] Oh! That's not money. It's from SpongeBob. [Puts on his glasses, and reads the postcard] ""Dear Mr... Krabs, please come to my house tonight. I am having a free money party."" Free money party!? This sounds too good to be true!",09,24,A SquarePants Family Vacation,11-Nov-11,24
15710,Squidward," ""Dear Squidward, come to my house tonight, I am having a...  ...latte sipping contest?"" This sound too good to be true!",Reads postcard surprised,"[Reads postcard] ""Dear Squidward, come to my house tonight, I am having a... [surprised] ...latte sipping contest?"" This sound too good to be true!",09,24,A SquarePants Family Vacation,11-Nov-11,24
15711,Sandy," ""Please come by my house tonight. I'm having a science fair!"" Oh, SpongeBob, this sounds too good to be true! ",Reading postcard Her science experiment fizzes,"[Reading postcard] ""Please come by my house tonight. I'm having a science fair!"" Oh, SpongeBob, this sounds too good to be true! [Her science experiment fizzes]",09,24,A SquarePants Family Vacation,11-Nov-11,24
15712,Larry," ""I am having a weight lifting competition!?"" This sounds too good to be true!",Reading postcard,"[Reading postcard] ""I am having a weight lifting competition!?"" This sounds too good to be true!",09,24,A SquarePants Family Vacation,11-Nov-11,24
15713,Mrs. Puff," ""A quiet evening studying the rules of the road!?""  Oh! Ahem... That sounds too good to be true.",Gasps as she reads postcard Laughs,"[Gasps as she reads postcard] ""A quiet evening studying the rules of the road!?"" [Laughs] Oh! Ahem... That sounds too good to be true.",09,24,A SquarePants Family Vacation,11-Nov-11,24
15714,Plankton," ""A meeting of the minds to discuss the ultimate downfall of the Krusty Krab!?"" This sounds too good to be true!",Reading postcard,"[Reading postcard] ""A meeting of the minds to discuss the ultimate downfall of the Krusty Krab!?"" This sounds too good to be true!",09,24,A SquarePants Family Vacation,11-Nov-11,24
15715,SpongeBob," Welcome, friends! Please come in!",opens the door,"[opens the door] Welcome, friends! Please come in!",09,24,A SquarePants Family Vacation,11-Nov-11,24
15716,SpongeBob,I'm so glad you all could make it! Tonight is going to be a magical evening filled with... magic!,,I'm so glad you all could make it! Tonight is going to be a magical evening filled with... magic!,09,24,A SquarePants Family Vacation,11-Nov-11,24
15717,Mr. Krabs,Eh... SpongeBob?,,Eh... SpongeBob?,09,24,A SquarePants Family Vacation,11-Nov-11,24
15718,SpongeBob,"Yes, Mr. Krabs?",,"Yes, Mr. Krabs?",09,24,A SquarePants Family Vacation,11-Nov-11,24
15719,Mr. Krabs,Can we skip the magic and get right to the free money?,,Can we skip the magic and get right to the free money?,09,24,A SquarePants Family Vacation,11-Nov-11,24
15720,Squidward,How 'bout the latte sipping?,,How 'bout the latte sipping?,09,24,A SquarePants Family Vacation,11-Nov-11,24
15721,Larry,And what about the pumping of the iron?,,And what about the pumping of the iron?,09,24,A SquarePants Family Vacation,11-Nov-11,24
15722,Plankton,And diabolical conspiracies?,,And diabolical conspiracies?,09,24,A SquarePants Family Vacation,11-Nov-11,24
15723,Sandy,And let's not forget the science fair!,,And let's not forget the science fair!,09,24,A SquarePants Family Vacation,11-Nov-11,24
15724,SpongeBob,The real reason I called you here was to watch this slideshow of photos from my family vacation!,,The real reason I called you here was to watch this slideshow of photos from my family vacation!,09,24,A SquarePants Family Vacation,11-Nov-11,24
15725,"Squidward, Sandy, Mr. Krabs, Plankton, Mrs. Puff, Larry, and Pearl",I knew it was too good to be true!,,I knew it was too good to be true!,09,24,A SquarePants Family Vacation,11-Nov-11,24
15726,Patrick,"Ahaha! Ahaha! Sorry I'm late, SpongeBob! I had to find my movie watching hat!",,"Ahaha! Ahaha! Sorry I'm late, SpongeBob! I had to find my movie watching hat!",09,24,A SquarePants Family Vacation,11-Nov-11,24
15727,Plankton,That does it... I'm gone.  Ow! Ow! Ow! Ow!,"Plankton starts to leave, but the others exit, and Larry squishes him, followed by Pearl, Mrs. Puff, and Sandy, all stepping on him","That does it... I'm gone. [Plankton starts to leave, but the others exit, and Larry squishes him, followed by Pearl, Mrs. Puff, and Sandy, all stepping on him] Ow! Ow! Ow! Ow!",09,24,A SquarePants Family Vacation,11-Nov-11,24
15728,SpongeBob,Wait! Wait! You're going to miss the first slide! ,Clicks button and sticks his tongue out,Wait! Wait! You're going to miss the first slide! [Clicks button and sticks his tongue out],09,24,A SquarePants Family Vacation,11-Nov-11,24
15729,Squidward,Looks more like a slip than a slide. Ha ha!,,Looks more like a slip than a slide. Ha ha!,09,24,A SquarePants Family Vacation,11-Nov-11,24
15730,Mr. Krabs,I've seen enough.,,I've seen enough.,09,24,A SquarePants Family Vacation,11-Nov-11,24
15731,SpongeBob,"Wait! Come back!  See, it's Patrick!",Moves projector,"Wait! Come back! [Moves projector] See, it's Patrick!",09,24,A SquarePants Family Vacation,11-Nov-11,24
15732,Patrick,Hey! It's me!,,Hey! It's me!,09,24,A SquarePants Family Vacation,11-Nov-11,24
15733,Squidward,Why is it all orange and blurry?,,Why is it all orange and blurry?,09,24,A SquarePants Family Vacation,11-Nov-11,24
15734,SpongeBob,Where?,,Where?,09,24,A SquarePants Family Vacation,11-Nov-11,24
15735,Squidward,"See, right there on the entire thing!",,"See, right there on the entire thing!",09,24,A SquarePants Family Vacation,11-Nov-11,24
15736,SpongeBob,Oh! That's because Patrick kept spraying the camera with Cheese Fizz!,,Oh! That's because Patrick kept spraying the camera with Cheese Fizz!,09,24,A SquarePants Family Vacation,11-Nov-11,24
15737,SpongeBob,Patrick! You're spraying the camera with Cheese Fizz! The pictures will come out all orange and blurry.,,Patrick! You're spraying the camera with Cheese Fizz! The pictures will come out all orange and blurry.,09,24,A SquarePants Family Vacation,11-Nov-11,24
15738,Patrick,"I can't help it, SpongeBob! I'm so excited about going on a family vacation with you and your parents that my aim is off!  See?  There we go...","Patrick sprays himself in the eye with Cheese Fizz. Patrick blinks, squirting the Cheese Fizz into his mouth and then licks his lips.","I can't help it, SpongeBob! I'm so excited about going on a family vacation with you and your parents that my aim is off! [Patrick sprays himself in the eye with Cheese Fizz.] See? [Patrick blinks, squirting the Cheese Fizz into his mouth and then licks his lips.] There we go...",09,24,A SquarePants Family Vacation,11-Nov-11,24
15739,SpongeBob,I know what you mean. Sometimes it feels like I've been waiting my entire life to go on this trip!,,I know what you mean. Sometimes it feels like I've been waiting my entire life to go on this trip!,09,24,A SquarePants Family Vacation,11-Nov-11,24
15740,Patrick,Really? Why is that?,,Really? Why is that?,09,24,A SquarePants Family Vacation,11-Nov-11,24
15741,SpongeBob,Probably because I have.,,Probably because I have.,09,24,A SquarePants Family Vacation,11-Nov-11,24
15742,Patrick,Have what?,,Have what?,09,24,A SquarePants Family Vacation,11-Nov-11,24
15743,SpongeBob,Been waiting.,,Been waiting.,09,24,A SquarePants Family Vacation,11-Nov-11,24
15744,Patrick, Wait... you mean so... What?,Breathing heavily,[Breathing heavily] Wait... you mean so... What?,09,24,A SquarePants Family Vacation,11-Nov-11,24
15745,SpongeBob,Patrick! They're here!,,Patrick! They're here!,09,24,A SquarePants Family Vacation,11-Nov-11,24
15746,Harold,"Good morning son, are you ready to head out?",,"Good morning son, are you ready to head out?",09,24,A SquarePants Family Vacation,11-Nov-11,24
15747,SpongeBob,You bet!,,You bet!,09,24,A SquarePants Family Vacation,11-Nov-11,24
15748,Margaret,SpongeBob! Don't leave your luggage behind! ,points to Patrick,SpongeBob! Don't leave your luggage behind! [points to Patrick],09,24,A SquarePants Family Vacation,11-Nov-11,24
15749,SpongeBob," That's not luggage, it's Patrick! He's coming with us, remember?",laughs,"[laughs] That's not luggage, it's Patrick! He's coming with us, remember?",09,24,A SquarePants Family Vacation,11-Nov-11,24
15750,Harold,"Well, shake a leg, boys. The Great Barrier Reef isn't gonna visit itself!",,"Well, shake a leg, boys. The Great Barrier Reef isn't gonna visit itself!",09,24,A SquarePants Family Vacation,11-Nov-11,24
15751,Margaret,"Your father's right, son!",,"Your father's right, son!",09,24,A SquarePants Family Vacation,11-Nov-11,24
15752,Harold, They know I'm right...,Muttering,[Muttering] They know I'm right...,09,24,A SquarePants Family Vacation,11-Nov-11,24
15753,Patrick, You brought homework?,As SpongeBob pulls out a map,[As SpongeBob pulls out a map] You brought homework?,09,24,A SquarePants Family Vacation,11-Nov-11,24
15754,SpongeBob,"No, Patrick, it's a brochure detailing all the fun we'll have at our final destination!  The Great Barrier Reef! See? there's a huge assortment of slides, and trampolines...",opens brochure,"No, Patrick, it's a brochure detailing all the fun we'll have at our final destination! [opens brochure] The Great Barrier Reef! See? there's a huge assortment of slides, and trampolines...",09,24,A SquarePants Family Vacation,11-Nov-11,24
15755,Patrick, And forts...,Drooling,[Drooling] And forts...,09,24,A SquarePants Family Vacation,11-Nov-11,24
15756,SpongeBob,And ropes to swing on...,,And ropes to swing on...,09,24,A SquarePants Family Vacation,11-Nov-11,24
15757,Patrick, And forts.,Still drooling,[Still drooling] And forts.,09,24,A SquarePants Family Vacation,11-Nov-11,24
15758,SpongeBob,"And a water park!  Oh wait, that's just where you drooled on it.  I can't wait to get there! How about you?","Camera zooms out, pans to Patrick drooling on map. Closes brochure","And a water park! [Camera zooms out, pans to Patrick drooling on map.] Oh wait, that's just where you drooled on it. [Closes brochure] I can't wait to get there! How about you?",09,24,A SquarePants Family Vacation,11-Nov-11,24
15759,Patrick,"No, I can't.",,"No, I can't.",09,24,A SquarePants Family Vacation,11-Nov-11,24
15760,SpongeBob, Yeah...,With his eyes closed,[With his eyes closed] Yeah...,09,24,A SquarePants Family Vacation,11-Nov-11,24
15761,Patrick," No, I mean I really can't.  I've been in this confined space for too long, somebody help!  Get me out of here!",Sweating Shouting bangs on the car windows,"[Sweating] No, I mean I really can't. [Shouting] I've been in this confined space for too long, somebody help! [bangs on the car windows] Get me out of here!",09,24,A SquarePants Family Vacation,11-Nov-11,24
15762,Harold,"Alright, boys, alright, turn down the volume back there.",,"Alright, boys, alright, turn down the volume back there.",09,24,A SquarePants Family Vacation,11-Nov-11,24
15763,Margaret, I have an idea! Why don't we play a road game to pass the time?,Turns to face the backseat,[Turns to face the backseat] I have an idea! Why don't we play a road game to pass the time?,09,24,A SquarePants Family Vacation,11-Nov-11,24
15764,SpongeBob,Yeah!,,Yeah!,09,24,A SquarePants Family Vacation,11-Nov-11,24
15765,Maragaret,Anybody know any?,,Anybody know any?,09,24,A SquarePants Family Vacation,11-Nov-11,24
15766,Patrick, Oh! Oh! Oh! Hide and seek! ,Raises hand frantically Patrick dives under the passenger seat.,[Raises hand frantically] Oh! Oh! Oh! Hide and seek! [Patrick dives under the passenger seat.],09,24,A SquarePants Family Vacation,11-Nov-11,24
15767,SpongeBob,"Hey, why does he get to go first?",,"Hey, why does he get to go first?",09,24,A SquarePants Family Vacation,11-Nov-11,24
15768,Harold," ""And she threw it all away...""",Singing,"[Singing] ""And she threw it all away...""",09,24,A SquarePants Family Vacation,11-Nov-11,24
15769,Patrick, Okay find me!,Flies into windshield,[Flies into windshield] Okay find me!,09,24,A SquarePants Family Vacation,11-Nov-11,24
15770,Harold,Egad!,,Egad!,09,24,A SquarePants Family Vacation,11-Nov-11,24
15771,SpongeBob,Maybe we should just sing the road song.,,Maybe we should just sing the road song.,09,24,A SquarePants Family Vacation,11-Nov-11,24
15772,Patrick,♪Road. Road. Road. Road.♪ ,Continues for rest of song,♪Road. Road. Road. Road.♪ [Continues for rest of song],09,24,A SquarePants Family Vacation,11-Nov-11,24
15773,SpongeBob,"♪When I'm on the road, I see stuff going by. When I'm on the road.♪",,"♪When I'm on the road, I see stuff going by. When I'm on the road.♪",09,24,A SquarePants Family Vacation,11-Nov-11,24
15774,Patrick,♪I got a bug in my eye.♪,,♪I got a bug in my eye.♪,09,24,A SquarePants Family Vacation,11-Nov-11,24
15775,SpongeBob,♪When I'm on the road.♪,,♪When I'm on the road.♪,09,24,A SquarePants Family Vacation,11-Nov-11,24
15776,Margaret,♪Looks like clear skies ahead.♪,,♪Looks like clear skies ahead.♪,09,24,A SquarePants Family Vacation,11-Nov-11,24
15777,SpongeBob,♪When I'm on the road.♪,,♪When I'm on the road.♪,09,24,A SquarePants Family Vacation,11-Nov-11,24
15778,Harold,♪Please stop touching my head.♪,,♪Please stop touching my head.♪,09,24,A SquarePants Family Vacation,11-Nov-11,24
15779,All,♪Let's all sing the road song.♪,,♪Let's all sing the road song.♪,09,24,A SquarePants Family Vacation,11-Nov-11,24
15780,SpongeBob,♪I want to sing it all day long.♪,,♪I want to sing it all day long.♪,09,24,A SquarePants Family Vacation,11-Nov-11,24
15781,All,♪Let's all sing the road song. Let's all sing along!♪,,♪Let's all sing the road song. Let's all sing along!♪,09,24,A SquarePants Family Vacation,11-Nov-11,24
15782,SpongeBob,Um... anybody know any other good road tunes?,,Um... anybody know any other good road tunes?,09,24,A SquarePants Family Vacation,11-Nov-11,24
15783,SpongeBob,How much farther to the nearest service station?,,How much farther to the nearest service station?,09,24,A SquarePants Family Vacation,11-Nov-11,24
15784,Harold,Probably pretty far son.,,Probably pretty far son.,09,24,A SquarePants Family Vacation,11-Nov-11,24
15785,SpongeBob,"Oh, you're right!",,"Oh, you're right!",09,24,A SquarePants Family Vacation,11-Nov-11,24
15786,Harold,"So, uh, how's it lookin'?",,"So, uh, how's it lookin'?",09,24,A SquarePants Family Vacation,11-Nov-11,24
15787,Service Station Worker," Well, it's got a cracked timing case cover, you've broken a couple keys off the timing gear, your radiator is damaged at the core, you got a cracked water pump, and a fractured injector line.",Pointing to objects in car,"[Pointing to objects in car] Well, it's got a cracked timing case cover, you've broken a couple keys off the timing gear, your radiator is damaged at the core, you got a cracked water pump, and a fractured injector line.",09,24,A SquarePants Family Vacation,11-Nov-11,24
15788,Margaret,And what does all that mean?,,And what does all that mean?,09,24,A SquarePants Family Vacation,11-Nov-11,24
15789,Service Station Worker,"Well little missy, in technical terms... if she don't wanna run, she don't wanna run!",,"Well little missy, in technical terms... if she don't wanna run, she don't wanna run!",09,24,A SquarePants Family Vacation,11-Nov-11,24
15790,Harold,Uh-huh. So what are we looking at time wise?,,Uh-huh. So what are we looking at time wise?,09,24,A SquarePants Family Vacation,11-Nov-11,24
15791,Service Station Worker,Well now that depends... how much time ya got? ,Service Station Worker starts laughing,Well now that depends... how much time ya got? [Service Station Worker starts laughing],09,24,A SquarePants Family Vacation,11-Nov-11,24
15792,Patrick, How much time ya-  Not funny.,Laughing All stare at Patrick,[Laughing] How much time ya- [All stare at Patrick] Not funny.,09,24,A SquarePants Family Vacation,11-Nov-11,24
15793,SpongeBob,Hey at least they have a cozy-looking waiting room!  Come on!,Points to outhouse.,Hey at least they have a cozy-looking waiting room! [Points to outhouse.] Come on!,09,24,A SquarePants Family Vacation,11-Nov-11,24
15794,SpongeBob,"Man, am I bored.",,"Man, am I bored.",09,24,A SquarePants Family Vacation,11-Nov-11,24
15795,Patrick,I am beyond bored. I am... be...yord.,,I am beyond bored. I am... be...yord.,09,24,A SquarePants Family Vacation,11-Nov-11,24
15796,Margaret, Oh boys! Is that a playground I see?,Looking out window,[Looking out window] Oh boys! Is that a playground I see?,09,24,A SquarePants Family Vacation,11-Nov-11,24
15797,Patrick,Not the most colorful playground I've seen.,,Not the most colorful playground I've seen.,09,24,A SquarePants Family Vacation,11-Nov-11,24
15798,SpongeBob,Mm-mmm. This looks more like a grey-ground.,,Mm-mmm. This looks more like a grey-ground.,09,24,A SquarePants Family Vacation,11-Nov-11,24
15799,Margaret,Well I'll just let you two amuse yourselves and come back for you when the boat's fixed.,,Well I'll just let you two amuse yourselves and come back for you when the boat's fixed.,09,24,A SquarePants Family Vacation,11-Nov-11,24
15800,SpongeBob, Actually this place seems a little bit-,Turns to Margaret,[Turns to Margaret] Actually this place seems a little bit-,09,24,A SquarePants Family Vacation,11-Nov-11,24
15801,Margaret,Have fun!,,Have fun!,09,24,A SquarePants Family Vacation,11-Nov-11,24
15802,Patrick,Well this is a nasty turn of events.,,Well this is a nasty turn of events.,09,24,A SquarePants Family Vacation,11-Nov-11,24
15803,SpongeBob,"You're preaching to the choir, Patrick.",,"You're preaching to the choir, Patrick.",09,24,A SquarePants Family Vacation,11-Nov-11,24
15804,Patrick," I knew it was gonna happen, too.",Crosses arms,"[Crosses arms] I knew it was gonna happen, too.",09,24,A SquarePants Family Vacation,11-Nov-11,24
15805,SpongeBob,You did? How?,,You did? How?,09,24,A SquarePants Family Vacation,11-Nov-11,24
15806,Patrick, Because it happens every time I keep my cheese fizz in my back pocket!  Darn! It's almost empty!,"Turns around to reveal Cheese Fizz spread across his shorts, reaches into pocket Sprays remaining cheese fizz into mouth before running out.","[Turns around to reveal Cheese Fizz spread across his shorts, reaches into pocket] Because it happens every time I keep my cheese fizz in my back pocket! [Sprays remaining cheese fizz into mouth before running out.] Darn! It's almost empty!",09,24,A SquarePants Family Vacation,11-Nov-11,24
15807,SpongeBob," Well, I guess we'll have to make the best of it.  This is fun! Hey Patrick, you- ",Walking towards see-saw Jumps onto see-saw while laughing. SpongeBob's speech becomes incoherent as he sinks into the mud.,"[Walking towards see-saw] Well, I guess we'll have to make the best of it. [Jumps onto see-saw while laughing.] This is fun! Hey Patrick, you- [SpongeBob's speech becomes incoherent as he sinks into the mud.]",09,24,A SquarePants Family Vacation,11-Nov-11,24
15808,Patrick," Huh?  SpongeBob, were you talking to me?  I could have sworn SpongeBob was calling me from this direction. SpongeBob, where are you?!",Spraying Cheese Fizz into mouth Patrick walks towards the mud that SpongeBob had sunk into. SpongeBob reaches his arms out of the mud,"[Spraying Cheese Fizz into mouth] Huh? [Patrick walks towards the mud that SpongeBob had sunk into.] SpongeBob, were you talking to me? [SpongeBob reaches his arms out of the mud] I could have sworn SpongeBob was calling me from this direction. SpongeBob, where are you?!",09,24,A SquarePants Family Vacation,11-Nov-11,24
15809,SpongeBob,"Hey, Patrick.",,"Hey, Patrick.",09,24,A SquarePants Family Vacation,11-Nov-11,24
15810,Patrick,"Huh? SpongeBob? Oh come on, where are you hiding? This isn't funny!  Huh. ",Looking around Puts hands on hips,"Huh? SpongeBob? Oh come on, where are you hiding? This isn't funny! [Looking around] Huh. [Puts hands on hips]",09,24,A SquarePants Family Vacation,11-Nov-11,24
15811,SpongeBob," Patrick, I'm right here.",Pokes Patrick,"[Pokes Patrick] Patrick, I'm right here.",09,24,A SquarePants Family Vacation,11-Nov-11,24
15812,Patrick," Oh, hey SpongeBob! How'd ya get there?",Looks at SpongeBob,"[Looks at SpongeBob] Oh, hey SpongeBob! How'd ya get there?",09,24,A SquarePants Family Vacation,11-Nov-11,24
15813,SpongeBob,"Well, I was on this see-saw-",,"Well, I was on this see-saw-",09,24,A SquarePants Family Vacation,11-Nov-11,24
15814,Patrick, Slide! ,"Yelling Bounces off of SpongeBob and onto slide. Patrick laughs and attempts to go down slide, but gets stuck and has to force himself down. The slide gets stuck to his bottom. Patrick tries to pull the slide off, but fails. The slide hits Patrick, and he goes flying.","[Yelling] Slide! [Bounces off of SpongeBob and onto slide. Patrick laughs and attempts to go down slide, but gets stuck and has to force himself down. The slide gets stuck to his bottom. Patrick tries to pull the slide off, but fails. The slide hits Patrick, and he goes flying.]",09,24,A SquarePants Family Vacation,11-Nov-11,24
15815,SpongeBob,"Patrick, do you need help?",,"Patrick, do you need help?",09,24,A SquarePants Family Vacation,11-Nov-11,24
15816,Patrick," Huh? With the slide stuck to my bottom? Nah, I want it there.  I hate you slide!  Oh, sorry SpongeBob. ","Walks up to SpongeBob with side still stuck Patrick stands motionless for a second. Pull slide off, flattening SpongeBob. SpongeBob sits motionless on the sand. Patrick pulls the slide off and throws it behind him","[Walks up to SpongeBob with side still stuck] Huh? With the slide stuck to my bottom? Nah, I want it there. [Patrick stands motionless for a second.] I hate you slide! [Pull slide off, flattening SpongeBob. SpongeBob sits motionless on the sand.] Oh, sorry SpongeBob. [Patrick pulls the slide off and throws it behind him]",09,24,A SquarePants Family Vacation,11-Nov-11,24
15817,SpongeBob," Hey look, a swingset!  Can't go wrong with this old-time playground favorite.  Weee. Hey, this is almost like being at The Great Barrier Reef, huh? Try it, Patrick.","Wobbles back up Flops over to the swings, pulling himself back up SpongeBob swings on swingset.","[Wobbles back up] Hey look, a swingset! [Flops over to the swings, pulling himself back up] Can't go wrong with this old-time playground favorite. [SpongeBob swings on swingset.] Weee. Hey, this is almost like being at The Great Barrier Reef, huh? Try it, Patrick.",09,24,A SquarePants Family Vacation,11-Nov-11,24
15818,Patrick,Okay.  It's not working.,Patrick sits motionless on swing.,Okay. [Patrick sits motionless on swing.] It's not working.,09,24,A SquarePants Family Vacation,11-Nov-11,24
15819,SpongeBob, Go back and forth like this.  There you go! Now you're getting into the... swing of things! ,Swinging Patrick starts swinging Laughing,[Swinging] Go back and forth like this. [Patrick starts swinging] There you go! Now you're getting into the... swing of things! [Laughing],09,24,A SquarePants Family Vacation,11-Nov-11,24
15820,Patrick," Hey, watch me go!",Starts laughing,"[Starts laughing] Hey, watch me go!",09,24,A SquarePants Family Vacation,11-Nov-11,24
15821,SpongeBob,Patrick?,,Patrick?,09,24,A SquarePants Family Vacation,11-Nov-11,24
15822,Patrick,,"Rolls into fence, breaking it and starts falling down a slide","[Rolls into fence, breaking it and starts falling down a slide]",09,24,A SquarePants Family Vacation,11-Nov-11,24
15823,SpongeBob,Patrick! I'm coming!,,Patrick! I'm coming!,09,24,A SquarePants Family Vacation,11-Nov-11,24
15824,SpongeBob,Patrick?,,Patrick?,09,24,A SquarePants Family Vacation,11-Nov-11,24
15825,Patrick, SpongeBob?,Muffled,[Muffled] SpongeBob?,09,24,A SquarePants Family Vacation,11-Nov-11,24
15826,SpongeBob,Patrick! Are you okay?,,Patrick! Are you okay?,09,24,A SquarePants Family Vacation,11-Nov-11,24
15827,Patrick,"No, I'm not okay.",,"No, I'm not okay.",09,24,A SquarePants Family Vacation,11-Nov-11,24
15828,SpongeBob,You're not?,,You're not?,09,24,A SquarePants Family Vacation,11-Nov-11,24
15829,Patrick,"No, I'm great! That was awesome! Let's do it again!",,"No, I'm great! That was awesome! Let's do it again!",09,24,A SquarePants Family Vacation,11-Nov-11,24
15830,SpongeBob,"Yeah, Patrick, wait for me.",,"Yeah, Patrick, wait for me.",09,24,A SquarePants Family Vacation,11-Nov-11,24
