id,speaker,speech,context,raw-dialouge,season,episode,title,airdate,runtime
18236,Patrick,"No. It's just a secret that everybody knows about.  What's wrong, SpongeBob?",seaweed is moving,"No. It's just a secret that everybody knows about. [seaweed is moving] What's wrong, SpongeBob?",08,12,The Wreck of the Mauna Loa,9-Oct-10,10
18237,SpongeBob,"Just as I thought. We're being followed. That's it!  Heh, looks like no one was following us to the secret hideout after all!","goes to the seaweed, opens it, but no one's there","Just as I thought. We're being followed. That's it! [goes to the seaweed, opens it, but no one's there] Heh, looks like no one was following us to the secret hideout after all!",08,12,The Wreck of the Mauna Loa,9-Oct-10,10
18238,Mr. Krabs,Found it!,,Found it!,08,12,The Wreck of the Mauna Loa,9-Oct-10,10
18239,SpongeBob,"Hey, were you following us?",,"Hey, were you following us?",08,12,The Wreck of the Mauna Loa,9-Oct-10,10
18240,Mr. Krabs,No. I just saw the sign.,,No. I just saw the sign.,08,12,The Wreck of the Mauna Loa,9-Oct-10,10
18241,Mr. Krabs,"So you thought you could hide the treasure from old Mr. Krabs, did ya?",,"So you thought you could hide the treasure from old Mr. Krabs, did ya?",08,12,The Wreck of the Mauna Loa,9-Oct-10,10
18242,SpongeBob,"I'm not aware of any treasure. But I suppose since you're such a nice boss, you can hang out at the hideout. Just as long as you keep it a secret.",,"I'm not aware of any treasure. But I suppose since you're such a nice boss, you can hang out at the hideout. Just as long as you keep it a secret.",08,12,The Wreck of the Mauna Loa,9-Oct-10,10
18243,Mr. Krabs," Yeah, yeah, nobody's treasure. You're such a nice boss. You expect me to believe this malarkey?!  You're a stonewall, eh? We'll see about that!  Where'd you two blunders find the gold coin?",mimicking SpongeBob SpongeBob and Patrick nod shines a flashlight into SpongeBob and Patrick's eyes,"[mimicking SpongeBob] Yeah, yeah, nobody's treasure. You're such a nice boss. You expect me to believe this malarkey?! [SpongeBob and Patrick nod] You're a stonewall, eh? We'll see about that! [shines a flashlight into SpongeBob and Patrick's eyes] Where'd you two blunders find the gold coin?",08,12,The Wreck of the Mauna Loa,9-Oct-10,10
18244,SpongeBob,"If my eyes weren't burning like they were full of lava, I could show you.",,"If my eyes weren't burning like they were full of lava, I could show you.",08,12,The Wreck of the Mauna Loa,9-Oct-10,10
18245,Mr. Krabs," Heh, jokers.",turns off the flashlight,"[turns off the flashlight] Heh, jokers.",08,12,The Wreck of the Mauna Loa,9-Oct-10,10
18246,Mr. Krabs," I knew I'd find it! Check it out, fellas, cool, hard doubloons!",laughs,"[laughs] I knew I'd find it! Check it out, fellas, cool, hard doubloons!",08,12,The Wreck of the Mauna Loa,9-Oct-10,10
18247,SpongeBob,"Uh, you might want to take a closer look at your coinage.",,"Uh, you might want to take a closer look at your coinage.",08,12,The Wreck of the Mauna Loa,9-Oct-10,10
18248,Mr. Krabs,"Eh? What's this? ""Token Has No Monetary Value?"" Tokens?! This must be a decoy. ",smashes two barrels on the ground,"Eh? What's this? ""Token Has No Monetary Value?"" Tokens?! This must be a decoy. [smashes two barrels on the ground]",08,12,The Wreck of the Mauna Loa,9-Oct-10,10
18249,SpongeBob,"Ahoy, Mr. Krabs! Maybe they hid the loot off ship in that shed!",,"Ahoy, Mr. Krabs! Maybe they hid the loot off ship in that shed!",08,12,The Wreck of the Mauna Loa,9-Oct-10,10
18250,Mr. Krabs," Whee-hee! What the barnacle? Well, it's just full of tickets!",zooms to the shed and jumps inside,"[zooms to the shed and jumps inside] Whee-hee! What the barnacle? Well, it's just full of tickets!",08,12,The Wreck of the Mauna Loa,9-Oct-10,10
18251,SpongeBob,"Well, you usually find tickets in a ticket booth.",,"Well, you usually find tickets in a ticket booth.",08,12,The Wreck of the Mauna Loa,9-Oct-10,10
18252,Mr. Krabs,Ticket booth?!,,Ticket booth?!,08,12,The Wreck of the Mauna Loa,9-Oct-10,10
18253,SpongeBob,And why are there height restrictions on the cruit?,,And why are there height restrictions on the cruit?,08,12,The Wreck of the Mauna Loa,9-Oct-10,10
18254,Mr. Krabs,"""Must Be This Tall To Ride?""",,"""Must Be This Tall To Ride?""",08,12,The Wreck of the Mauna Loa,9-Oct-10,10
18255,Patrick,"Well, maybe they had something against short people. I like their little clothes.",,"Well, maybe they had something against short people. I like their little clothes.",08,12,The Wreck of the Mauna Loa,9-Oct-10,10
18256,SpongeBob,"Captain's Quarters. There must be some treasure here, Mr. Krabs!",,"Captain's Quarters. There must be some treasure here, Mr. Krabs!",08,12,The Wreck of the Mauna Loa,9-Oct-10,10
18257,Mr. Krabs," Out of me way, boy.  I knew it. The lost treasure of the Mauna Loa is finally mine! I can practically taste them jewels.  It's a little lighter than I thought. Huh? It's empty.  No good. Ha, ha, very clever, captain. Throw in Krabs, the old ringer, eh? You must have a treasure map or something. Where you keeping it? In your pocket?  Plastic? Hang on a minute. A plastic captain... a ticket booth... tokens? It's not the Wreck of the Mauna Loa, It's ""The Wreck of the Mauna Loa"" amusement park ride! ",pushes SpongeBob out of the way sees a treasure box carries the treasure box but falls and the box breaks throws the box on the ground taps the skeleton SpongeBob and Patrick gasp,"[pushes SpongeBob out of the way] Out of me way, boy. [sees a treasure box] I knew it. The lost treasure of the Mauna Loa is finally mine! I can practically taste them jewels. [carries the treasure box but falls and the box breaks] It's a little lighter than I thought. Huh? It's empty. [throws the box on the ground] No good. Ha, ha, very clever, captain. Throw in Krabs, the old ringer, eh? You must have a treasure map or something. Where you keeping it? In your pocket? [taps the skeleton] Plastic? Hang on a minute. A plastic captain... a ticket booth... tokens? It's not the Wreck of the Mauna Loa, It's ""The Wreck of the Mauna Loa"" amusement park ride! [SpongeBob and Patrick gasp]",08,12,The Wreck of the Mauna Loa,9-Oct-10,10
18258,Patrick,No wonder we were so amused!,,No wonder we were so amused!,08,12,The Wreck of the Mauna Loa,9-Oct-10,10
18259,Mr. Krabs,"Well, I'm not!",,"Well, I'm not!",08,12,The Wreck of the Mauna Loa,9-Oct-10,10
18260,SpongeBob,"Remember, you're always welcome back at the secret hideout.",,"Remember, you're always welcome back at the secret hideout.",08,12,The Wreck of the Mauna Loa,9-Oct-10,10
18261,Mr. Krabs,This place ain't got no treasure! Keep your worthless hunk of junk!,,This place ain't got no treasure! Keep your worthless hunk of junk!,08,12,The Wreck of the Mauna Loa,9-Oct-10,10
18262,SpongeBob,"Okay, but, would you mind keeping this worthless hunk of junk a secret? Wouldn't be much of a secret if we had a million people showing up!",,"Okay, but, would you mind keeping this worthless hunk of junk a secret? Wouldn't be much of a secret if we had a million people showing up!",08,12,The Wreck of the Mauna Loa,9-Oct-10,10
18263,Mr. Krabs,"Oh-ho-ho, don't flatten yourself. People want to see the real thing! It's not like a million people just show up to an old amusement park ride for fun.  Wait a minute. That's exactly what they do. Oh-ho-ho, brace yourself, fellas. Your hideaway's about to become the worst kept secret in the sea!",turns away but stops,"Oh-ho-ho, don't flatten yourself. People want to see the real thing! It's not like a million people just show up to an old amusement park ride for fun. [turns away but stops] Wait a minute. That's exactly what they do. Oh-ho-ho, brace yourself, fellas. Your hideaway's about to become the worst kept secret in the sea!",08,12,The Wreck of the Mauna Loa,9-Oct-10,10
18264,Squidward, Welcome to The Wreck of the Mauna Loa. Arr. How may I help you?,dressed as a pirate,[dressed as a pirate] Welcome to The Wreck of the Mauna Loa. Arr. How may I help you?,08,12,The Wreck of the Mauna Loa,9-Oct-10,10
18265,Dennis,"I'll take 10 tokens, please.",,"I'll take 10 tokens, please.",08,12,The Wreck of the Mauna Loa,9-Oct-10,10
18266,Mr. Krabs," Step right up, don't be shy! Experience the amusement and terror of The Wreck of the Mauna Loa!",into the megaphone,"[into the megaphone] Step right up, don't be shy! Experience the amusement and terror of The Wreck of the Mauna Loa!",08,12,The Wreck of the Mauna Loa,9-Oct-10,10
18267,Mr. Krabs," That's right, folks! We spare no expense to restore this plastic ship to its former glory!",again into the megaphone,"[again into the megaphone] That's right, folks! We spare no expense to restore this plastic ship to its former glory!",08,12,The Wreck of the Mauna Loa,9-Oct-10,10
18268,Nazz-Mimi,"Sorry, honey, but you'll have to come back when you're a big boy.",,"Sorry, honey, but you'll have to come back when you're a big boy.",08,12,The Wreck of the Mauna Loa,9-Oct-10,10
18269,Mr. Krabs,"Oh-ho-ho, I disagree. I'd say the little  feller's just right. ",pushes the height restrictions into the ground laughs,"Oh-ho-ho, I disagree. I'd say the little [pushes the height restrictions into the ground] feller's just right. [laughs]",08,12,The Wreck of the Mauna Loa,9-Oct-10,10
18270,SpongeBob and Patrick,,tears in their eyes,[tears in their eyes],08,12,The Wreck of the Mauna Loa,9-Oct-10,10
18271,SpongeBob,"It's gone, Patrick. Our secret paradise is gone forever! ",sniffs,"It's gone, Patrick. Our secret paradise is gone forever! [sniffs]",08,12,The Wreck of the Mauna Loa,9-Oct-10,10
18272,Patrick,"And alas, even the joyous shrieks of children cannot lift my sunken heart!",,"And alas, even the joyous shrieks of children cannot lift my sunken heart!",08,12,The Wreck of the Mauna Loa,9-Oct-10,10
18273,SpongeBob,How 'bout another ride to cheer you up?,,How 'bout another ride to cheer you up?,08,12,The Wreck of the Mauna Loa,9-Oct-10,10
18274,Patrick,Let's do this!,,Let's do this!,08,12,The Wreck of the Mauna Loa,9-Oct-10,10
18275,SpongeBob and Patrick,"Whoo-hoo! Ha, ha! Woo-hoo!  Woo-hoo! ","Dale, Scooter and Abigail-Marge fall of the boat and they run away. Pieces fall from the boat, hitting the lever, moving it from slow to fast to beyond fast to beyond comprehension. The boat moves back and forth then it goes really fast causing it to go round and round in a circle. People fly out of the boat then the leg on the ground breaks and then the boat flies by itself then it crashes into the ground, causing it to break into pieces whoop and laugh","Whoo-hoo! Ha, ha! Woo-hoo! [Dale, Scooter and Abigail-Marge fall of the boat and they run away. Pieces fall from the boat, hitting the lever, moving it from slow to fast to beyond fast to beyond comprehension. The boat moves back and forth then it goes really fast causing it to go round and round in a circle. People fly out of the boat then the leg on the ground breaks and then the boat flies by itself then it crashes into the ground, causing it to break into pieces] Woo-hoo! [whoop and laugh]",08,12,The Wreck of the Mauna Loa,9-Oct-10,10
18276,SpongeBob,That was awesome!,,That was awesome!,08,12,The Wreck of the Mauna Loa,9-Oct-10,10
18277,Patrick,Yeah! Totally realistic!,,Yeah! Totally realistic!,08,12,The Wreck of the Mauna Loa,9-Oct-10,10
18278,Harold, Realistic? That realism nearly cost us our lives!,Emerging from the debris,[Emerging from the debris] Realistic? That realism nearly cost us our lives!,08,12,The Wreck of the Mauna Loa,9-Oct-10,10
18279,Sally,Mr. Krabs put all our lives in danger with this careless contraption!,,Mr. Krabs put all our lives in danger with this careless contraption!,08,12,The Wreck of the Mauna Loa,9-Oct-10,10
18280,Nazz-Mimi,What were you thinking? Our little boy could've been hurt on your disaster of a ride!,,What were you thinking? Our little boy could've been hurt on your disaster of a ride!,08,12,The Wreck of the Mauna Loa,9-Oct-10,10
18281,Mr. Krabs,"Okay, people, let's not do anything we might regret!",,"Okay, people, let's not do anything we might regret!",08,12,The Wreck of the Mauna Loa,9-Oct-10,10
18282,Fish Cop,"Too late for that, Krabs. ",handcuffs Mr. Krabs,"Too late for that, Krabs. [handcuffs Mr. Krabs]",08,12,The Wreck of the Mauna Loa,9-Oct-10,10
18283,Mr. Krabs,What—what—what are you talking about? You can't take me to the pokey! I—,,What—what—what are you talking about? You can't take me to the pokey! I—,08,12,The Wreck of the Mauna Loa,9-Oct-10,10
18284,Fish Cop,"For operating a danger to public safety I can, and I will. Honestly, I think he'll be safer in prison.",,"For operating a danger to public safety I can, and I will. Honestly, I think he'll be safer in prison.",08,12,The Wreck of the Mauna Loa,9-Oct-10,10
18285,SpongeBob,"Well, Patrick, I guess we really lost our secret hideout this time.",,"Well, Patrick, I guess we really lost our secret hideout this time.",08,12,The Wreck of the Mauna Loa,9-Oct-10,10
18286,Patrick,"And just when everyone was starting to find out about it, too.",,"And just when everyone was starting to find out about it, too.",08,12,The Wreck of the Mauna Loa,9-Oct-10,10
18287,SpongeBob,"Oh, who knows, Patrick? The next fun, fun place might be just around the corner, huh?",,"Oh, who knows, Patrick? The next fun, fun place might be just around the corner, huh?",08,12,The Wreck of the Mauna Loa,9-Oct-10,10
18288,Patrick,"Well, I doubt it.",,"Well, I doubt it.",08,12,The Wreck of the Mauna Loa,9-Oct-10,10
18289,SpongeBob,"""The Real Mauna Loa?"" Ooh, Patrick, do you want to keep a secret?",,"""The Real Mauna Loa?"" Ooh, Patrick, do you want to keep a secret?",08,12,The Wreck of the Mauna Loa,9-Oct-10,10
18290,Patrick, Nope!,raises his head,[raises his head] Nope!,08,12,The Wreck of the Mauna Loa,9-Oct-10,10
20099,Nancy Suzy Fish,"Pearl, come on! The line for the Tunnel of Glove is filling up! This is going to be so, totally like, fun!",,"Pearl, come on! The line for the Tunnel of Glove is filling up! This is going to be so, totally like, fun!",08,24,Tunnel of Glove,12-Feb-11,10
20100,SpongeBob,"Hey, Pearl!",,"Hey, Pearl!",08,24,Tunnel of Glove,12-Feb-11,10
20101,Pearl,"Barnacles, SpongeBob, why are you talking to me?",,"Barnacles, SpongeBob, why are you talking to me?",08,24,Tunnel of Glove,12-Feb-11,10
20102,Nancy,Is that your boyfriend?,,Is that your boyfriend?,08,24,Tunnel of Glove,12-Feb-11,10
20103,SpongeBob,"Well, I am a boy, and I am her friend. ",Laughs,"Well, I am a boy, and I am her friend. [Laughs]",08,24,Tunnel of Glove,12-Feb-11,10
20104,Nancy and Debbie,,Laughs,[Laughs],08,24,Tunnel of Glove,12-Feb-11,10
20105,Nancy,SpongeBob! Stand here for a second! ,Moves SpongeBob next to Pearl,SpongeBob! Stand here for a second! [Moves SpongeBob next to Pearl],08,24,Tunnel of Glove,12-Feb-11,10
20106,Nancy,,Giggles,[Giggles],08,24,Tunnel of Glove,12-Feb-11,10
20107,Debbie, Just thought we should keep this moment for... posterity. ,Holds Camera Shows Nancy,[Holds Camera] Just thought we should keep this moment for... posterity. [Shows Nancy],08,24,Tunnel of Glove,12-Feb-11,10
20108,Nancy and Debbie, Pearl's got a boyfriend! Pearl's got a boyfriend! Pearl's got a boyfriend!,Giggle,[Giggle] Pearl's got a boyfriend! Pearl's got a boyfriend! Pearl's got a boyfriend!,08,24,Tunnel of Glove,12-Feb-11,10
20109,Patrick, I didn't know you had a girlfriend.,To SpongeBob,[To SpongeBob] I didn't know you had a girlfriend.,08,24,Tunnel of Glove,12-Feb-11,10
20110,Pearl,Quiet! He is not my boyfriend!,,Quiet! He is not my boyfriend!,08,24,Tunnel of Glove,12-Feb-11,10
20111,Patrick,"That was fast.  Don't worry, buddy, there's plenty of fish in the street car.",To SpongeBob,"That was fast. [To SpongeBob] Don't worry, buddy, there's plenty of fish in the street car.",08,24,Tunnel of Glove,12-Feb-11,10
20112,Nancy,"Anyway, let's go to the ride!",,"Anyway, let's go to the ride!",08,24,Tunnel of Glove,12-Feb-11,10
20113,SpongeBob,"Bye, Pearl! Tell Mr. Krabs I said ""Hi,"" Let's bounce Patrick. Patrick?",,"Bye, Pearl! Tell Mr. Krabs I said ""Hi,"" Let's bounce Patrick. Patrick?",08,24,Tunnel of Glove,12-Feb-11,10
20114,Patrick," Busy, I'll catch up with you later.",Eating Cotton Candy at a Stand,"[Eating Cotton Candy at a Stand] Busy, I'll catch up with you later.",08,24,Tunnel of Glove,12-Feb-11,10
20115,Man, Next!,Opens Metal Gate to the Ride Boats,[Opens Metal Gate to the Ride Boats] Next!,08,24,Tunnel of Glove,12-Feb-11,10
20116,Nancy," Come on, Pearl!",Walks through with Debby,"[Walks through with Debby] Come on, Pearl!",08,24,Tunnel of Glove,12-Feb-11,10
20117,Man," Sorry, only two per car. You'll have to wait for the next car.  Any single riders come to the front!",Holds Hand Out To The Line,"[Holds Hand Out] Sorry, only two per car. You'll have to wait for the next car. [To The Line] Any single riders come to the front!",08,24,Tunnel of Glove,12-Feb-11,10
20118,SpongeBob,"Oh! I'm a single rider!  Excuse me, pardon me, excuse me, pardon me, excuse me, pardon me!",Walks through Line,"Oh! I'm a single rider! [Walks through Line] Excuse me, pardon me, excuse me, pardon me, excuse me, pardon me!",08,24,Tunnel of Glove,12-Feb-11,10
20119,SpongeBob," After you, fellow single rider Pearl.",Holds hands out to direct Pearl into the Car,"[Holds hands out to direct Pearl into the Car] After you, fellow single rider Pearl.",08,24,Tunnel of Glove,12-Feb-11,10
20120,Pearl,,Groans,[Groans],08,24,Tunnel of Glove,12-Feb-11,10
20121,Intercom System,"Please keep your arms and legs inside at all times. And do not leave the boat until the ride, is over. Thank you!",,"Please keep your arms and legs inside at all times. And do not leave the boat until the ride, is over. Thank you!",08,24,Tunnel of Glove,12-Feb-11,10
20122,SpongeBob,"Uhm, Pearl. Your arm... it's outside the boat.",,"Uhm, Pearl. Your arm... it's outside the boat.",08,24,Tunnel of Glove,12-Feb-11,10
20123,Pearl,"Ugh, I will put my arm in the boat. But don't touch me, don't talk to me, don't even look at me!",,"Ugh, I will put my arm in the boat. But don't touch me, don't talk to me, don't even look at me!",08,24,Tunnel of Glove,12-Feb-11,10
20124,SpongeBob,,Zippers Mouth and Eyes Shut,[Zippers Mouth and Eyes Shut],08,24,Tunnel of Glove,12-Feb-11,10
20125,Pearl,BORING!,,BORING!,08,24,Tunnel of Glove,12-Feb-11,10
20126,Metal Angel,Will my arrow find her heart?,,Will my arrow find her heart?,08,24,Tunnel of Glove,12-Feb-11,10
20127,Pearl,"Ugh, this ride is lame! Hey! You're allowed to speak now!",,"Ugh, this ride is lame! Hey! You're allowed to speak now!",08,24,Tunnel of Glove,12-Feb-11,10
20128,SpongeBob,"  I bet Mr. Krabs would get a kick out of this ride, don't you think? I mean he's so tough on the outside, but he's got a soft side, too. You know, this one time I was upset because my snail Gary he was sick and he let me leave 5 minutes early. Isn't that the sweetest thing you've ever heard?  Blah blah blah blah blah blah blah blah",Unzippers eyes and mouth Quickly Mouth becomes microphone,"[Unzippers eyes and mouth] [Quickly] I bet Mr. Krabs would get a kick out of this ride, don't you think? I mean he's so tough on the outside, but he's got a soft side, too. You know, this one time I was upset because my snail Gary he was sick and he let me leave 5 minutes early. Isn't that the sweetest thing you've ever heard? [Mouth becomes microphone] Blah blah blah blah blah blah blah blah",08,24,Tunnel of Glove,12-Feb-11,10
20129,Narrator,Two very boring minutes later...,,Two very boring minutes later...,08,24,Tunnel of Glove,12-Feb-11,10
20130,SpongeBob,"And theeeen, there was that time that Mr. Krabs yelled at me for getting to work before he did, and he didn't even dock my pay. What a sweet man!",,"And theeeen, there was that time that Mr. Krabs yelled at me for getting to work before he did, and he didn't even dock my pay. What a sweet man!",08,24,Tunnel of Glove,12-Feb-11,10
20131,Pearl, You are making this ride even more boring! Is such a thing is possible!,screams,[screams] You are making this ride even more boring! Is such a thing is possible!,08,24,Tunnel of Glove,12-Feb-11,10
20132,SpongeBob,You're supposed to remain seated until the ride's come to a COMPLEEETE-  Stop! ,"SpongeBob is launched up onto the ceiling and knocks over a few hearts. One lands in the water. SpongeBob lands next to a stunned Pearl one of the hearts lands in one of the ride's controls, jamming it. Then, the ride stops","You're supposed to remain seated until the ride's come to a COMPLEEETE- [SpongeBob is launched up onto the ceiling and knocks over a few hearts. One lands in the water. SpongeBob lands next to a stunned Pearl] Stop! [one of the hearts lands in one of the ride's controls, jamming it. Then, the ride stops]",08,24,Tunnel of Glove,12-Feb-11,10
20133,Pearl,What was that?!,,What was that?!,08,24,Tunnel of Glove,12-Feb-11,10
20134,Voice over Microphone,Attention sweethearts! We are experiencing technical difficulties. Please remain seated.,,Attention sweethearts! We are experiencing technical difficulties. Please remain seated.,08,24,Tunnel of Glove,12-Feb-11,10
20135,Pearl,"Oh, great! Just great!",,"Oh, great! Just great!",08,24,Tunnel of Glove,12-Feb-11,10
20136,Narrator,Three hours later...,,Three hours later...,08,24,Tunnel of Glove,12-Feb-11,10
20137,Perch Perkins,"Breaking News! The Tunnel of Glove has turned into a Tunnel of Terror! Just hours ago, the mechanism that controls the boats mysteriously stopped, trapping the doomed couple inside. We have the youth's friends here, who escaped the tunnel before tragedy befell the two sweethearts.",,"Breaking News! The Tunnel of Glove has turned into a Tunnel of Terror! Just hours ago, the mechanism that controls the boats mysteriously stopped, trapping the doomed couple inside. We have the youth's friends here, who escaped the tunnel before tragedy befell the two sweethearts.",08,24,Tunnel of Glove,12-Feb-11,10
20138,Nancy, It's true! We barely escaped with our lives! It was horrible!,Crying,[Crying] It's true! We barely escaped with our lives! It was horrible!,08,24,Tunnel of Glove,12-Feb-11,10
20139,Perch Perkins,And what was the name of your friends?,,And what was the name of your friends?,08,24,Tunnel of Glove,12-Feb-11,10
20140,Nancy," Pearl, and her boyfriend SpongeBob! ",Still crying Both walk away giggling,"[Still crying] Pearl, and her boyfriend SpongeBob! [Both walk away giggling]",08,24,Tunnel of Glove,12-Feb-11,10
20141,Perch Perkins,So there you have it. As time quickly runs out  still no word from the imperiled whale girl and SpongeBob.,Scene zooms out to a big screen with Patrick sitting next to it eating a whole bunch of junk food,So there you have it. As time quickly runs out [Scene zooms out to a big screen with Patrick sitting next to it eating a whole bunch of junk food] still no word from the imperiled whale girl and SpongeBob.,08,24,Tunnel of Glove,12-Feb-11,10
20142,Patrick," Oh, no! I'm out of coral on a stick!  Time to chomp through the fried barnacles!",Startled Throws stick away,"[Startled] Oh, no! I'm out of coral on a stick! [Throws stick away] Time to chomp through the fried barnacles!",08,24,Tunnel of Glove,12-Feb-11,10
20143,Perch Perkins," At this time survival looks bleek, for the little yellow sponge.",Starts talking as Patrick continues to eat,"[Starts talking as Patrick continues to eat] At this time survival looks bleek, for the little yellow sponge.",08,24,Tunnel of Glove,12-Feb-11,10
20144,Patrick,Nooooooo! This is my worst nightmare! I don't have a drink!,,Nooooooo! This is my worst nightmare! I don't have a drink!,08,24,Tunnel of Glove,12-Feb-11,10
20145,Perch Perkins,"Hey, doofus!",,"Hey, doofus!",08,24,Tunnel of Glove,12-Feb-11,10
20146,Patrick,Huh?,,Huh?,08,24,Tunnel of Glove,12-Feb-11,10
20147,Perch Perkins,Your best buddy is trapped in the tunnel of glove and he may never escape!,,Your best buddy is trapped in the tunnel of glove and he may never escape!,08,24,Tunnel of Glove,12-Feb-11,10
20148,Patrick,You mean SpongeBob?,,You mean SpongeBob?,08,24,Tunnel of Glove,12-Feb-11,10
20149,Patrick,"I'm coming, SpongeBob!",,"I'm coming, SpongeBob!",08,24,Tunnel of Glove,12-Feb-11,10
20150,Policeman,Hold it! No one beyond this point!,,Hold it! No one beyond this point!,08,24,Tunnel of Glove,12-Feb-11,10
20151,Patrick, My best buddy is trapped in there! You gotta let me through!,Mad,[Mad] My best buddy is trapped in there! You gotta let me through!,08,24,Tunnel of Glove,12-Feb-11,10
20152,Policeman,"No can do, big guy. Too dangerous.",,"No can do, big guy. Too dangerous.",08,24,Tunnel of Glove,12-Feb-11,10
20153,Patrick,"Fine!  Well, mister police guy won't let me in the front, huh! Well, I'll just find my own way in!",Walks away,"Fine! [Walks away] Well, mister police guy won't let me in the front, huh! Well, I'll just find my own way in!",08,24,Tunnel of Glove,12-Feb-11,10
