id,speaker,speech,context,raw-dialouge,season,episode,title,airdate,runtime
115,Pearl,"Boy, do I love high school. . You know what? Someday we're gonna remember all this, and we're gonna look back and say... Remember?",small laugh,"Boy, do I love high school. [small laugh]. You know what? Someday we're gonna remember all this, and we're gonna look back and say... Remember?",09,13,Barnacle Face,16-Sep-11,10
116,Pearl's friend," Speaking of remembering, you didn't forget the Bikini Bottom High School Dance is tomorrow night, did you?",laughing,"[laughing] Speaking of remembering, you didn't forget the Bikini Bottom High School Dance is tomorrow night, did you?",09,13,Barnacle Face,16-Sep-11,10
117,Pearl, Of course I didn't forget. I'm so excited.,Joyfully,[Joyfully] Of course I didn't forget. I'm so excited.,09,13,Barnacle Face,16-Sep-11,10
118,Pearl's friend," Me, too!",laughs,"[laughs] Me, too!",09,13,Barnacle Face,16-Sep-11,10
119,Pearl's friend, Barnacle!,In horror,[In horror] Barnacle!,09,13,Barnacle Face,16-Sep-11,10
120,Pearl,What!?,,What!?,09,13,Barnacle Face,16-Sep-11,10
121,Pearl's friend,Pearl I'm gonna say this as touchily as possible.  There is a hideous barnacle growing out of the side of your face!,pointing,Pearl I'm gonna say this as touchily as possible. [pointing] There is a hideous barnacle growing out of the side of your face!,09,13,Barnacle Face,16-Sep-11,10
122,Pearl, Where!?,Shocked,[Shocked] Where!?,09,13,Barnacle Face,16-Sep-11,10
123,Pearl's friend,There!,,There!,09,13,Barnacle Face,16-Sep-11,10
124,Pearl's friend,"Pearl, it's not really bad as you...",,"Pearl, it's not really bad as you...",09,13,Barnacle Face,16-Sep-11,10
125,Mr. Krabs,SpongeBob?,,SpongeBob?,09,13,Barnacle Face,16-Sep-11,10
126,SpongeBob," Yes, Mr. Krabs?",stops mopping,"[stops mopping] Yes, Mr. Krabs?",09,13,Barnacle Face,16-Sep-11,10
127,Mr. Krabs,Didn't you already mop this area?,,Didn't you already mop this area?,09,13,Barnacle Face,16-Sep-11,10
128,SpongeBob," Affirmative, captain!",laughs,"[laughs] Affirmative, captain!",09,13,Barnacle Face,16-Sep-11,10
129,Mr. Krabs,"Well, then, why would you mop it again?",,"Well, then, why would you mop it again?",09,13,Barnacle Face,16-Sep-11,10
130,SpongeBob,Why wouldn't I? ,there is a pause,Why wouldn't I? [there is a pause],09,13,Barnacle Face,16-Sep-11,10
131,Mr. Krabs,Good point.,,Good point.,09,13,Barnacle Face,16-Sep-11,10
132,Mr. Krabs,"Pearl, what brings you in on such a fine afternoon?",,"Pearl, what brings you in on such a fine afternoon?",09,13,Barnacle Face,16-Sep-11,10
133,Pearl,"Oh, Daddy! It's terrible. The school dance is this weekend.",,"Oh, Daddy! It's terrible. The school dance is this weekend.",09,13,Barnacle Face,16-Sep-11,10
134,Mr. Krabs,"Oooh, that is terrible.  Makes my shell crawl just thinking about it. Bleugh!",he shivers,"Oooh, that is terrible. [he shivers] Makes my shell crawl just thinking about it. Bleugh!",09,13,Barnacle Face,16-Sep-11,10
135,Pearl,"No, daddy! Don't you understand?! The terrible part is that I can't go to the dance!",,"No, daddy! Don't you understand?! The terrible part is that I can't go to the dance!",09,13,Barnacle Face,16-Sep-11,10
136,Mr. Krabs, Why ever not?,comes closer,[comes closer] Why ever not?,09,13,Barnacle Face,16-Sep-11,10
137,Pearl,Because I have a hideous barnacle growing on the side of my face!,,Because I have a hideous barnacle growing on the side of my face!,09,13,Barnacle Face,16-Sep-11,10
138,Mr. Krabs,"Oh-ho-ho-ho. Now, calm down there, my little Pearl. I'm sure it can't be half as awful as you...  Great rusty hinges of Davy Jones' Locker!",pus is shown oozing out of the barnacle; Krabs screams,"Oh-ho-ho-ho. Now, calm down there, my little Pearl. I'm sure it can't be half as awful as you... [pus is shown oozing out of the barnacle; Krabs screams] Great rusty hinges of Davy Jones' Locker!",09,13,Barnacle Face,16-Sep-11,10
139,Pearl,"We have to get rid of it, no matter what it takes!",,"We have to get rid of it, no matter what it takes!",09,13,Barnacle Face,16-Sep-11,10
140,Mr. Krabs,Anything for me beloved angel!,,Anything for me beloved angel!,09,13,Barnacle Face,16-Sep-11,10
141,Pearl,"Oh, okay. I need an appointment with a dermatologist, a trip to the spa, expensive creams and lotions, and probably some other kind of... ","Krabs stops her, angrily","Oh, okay. I need an appointment with a dermatologist, a trip to the spa, expensive creams and lotions, and probably some other kind of... [Krabs stops her, angrily]",09,13,Barnacle Face,16-Sep-11,10
142,Mr. Krabs,"I meant whatever you need to get rid of your blemish, not liquidate me retirement fund. ","this causes Pearl to cry again, soaking a table Harold and Nat are having lunch at","I meant whatever you need to get rid of your blemish, not liquidate me retirement fund. [this causes Pearl to cry again, soaking a table Harold and Nat are having lunch at]",09,13,Barnacle Face,16-Sep-11,10
143,Harold,You know what? Let's go across the street to the Chum Bucket.,,You know what? Let's go across the street to the Chum Bucket.,09,13,Barnacle Face,16-Sep-11,10
144,Nat,I heard they have better weather over there. ,They leave the Krusty Krab,I heard they have better weather over there. [They leave the Krusty Krab],09,13,Barnacle Face,16-Sep-11,10
145,Mr. Krabs," No! Wait!  This is starting to eat away me profit margin. If I don't come up with a solution fast, it's gonna cost me more than a couple cases of cold cream. ",chases after them but fails Pearl continues to wail He notices SpongeBob mopping past him,"[chases after them but fails] No! Wait! [Pearl continues to wail] This is starting to eat away me profit margin. If I don't come up with a solution fast, it's gonna cost me more than a couple cases of cold cream. [He notices SpongeBob mopping past him]",09,13,Barnacle Face,16-Sep-11,10
146,SpongeBob,,sings,[sings],09,13,Barnacle Face,16-Sep-11,10
147,Mr. Krabs,"Oh, SpongeBob.  How would you like to...  At ease!  How would you like to do your dear old chum a favor and rid his beautiful daughter of her evil barnacle?",SpongeBob stops He salutes SpongeBob drops his hand,"Oh, SpongeBob. [SpongeBob stops] How would you like to... [He salutes] At ease! [SpongeBob drops his hand] How would you like to do your dear old chum a favor and rid his beautiful daughter of her evil barnacle?",09,13,Barnacle Face,16-Sep-11,10
148,SpongeBob,"I will do you this favor, sir chum, never fear!",,"I will do you this favor, sir chum, never fear!",09,13,Barnacle Face,16-Sep-11,10
149,Pearl,"I don't know, SpongeBob. The school dance is right around the corner, and this barnacle seems to be getting bigger by the minute!",,"I don't know, SpongeBob. The school dance is right around the corner, and this barnacle seems to be getting bigger by the minute!",09,13,Barnacle Face,16-Sep-11,10
150,SpongeBob,"Don't fear, Pearl. We'll get rid of this barnacle in no time! I know just what to do!",,"Don't fear, Pearl. We'll get rid of this barnacle in no time! I know just what to do!",09,13,Barnacle Face,16-Sep-11,10
151,Pearl,Are you sure?,,Are you sure?,09,13,Barnacle Face,16-Sep-11,10
152,SpongeBob,"One time, my friend Patrick had this barnacle the size of an extra large Krabby Patty right at the center of his forehead! Anyway, I fixed it so we never saw that barnacle again.",,"One time, my friend Patrick had this barnacle the size of an extra large Krabby Patty right at the center of his forehead! Anyway, I fixed it so we never saw that barnacle again.",09,13,Barnacle Face,16-Sep-11,10
153,Pearl,How?,,How?,09,13,Barnacle Face,16-Sep-11,10
154,SpongeBob,I took him to see a hypnotist.,,I took him to see a hypnotist.,09,13,Barnacle Face,16-Sep-11,10
155,Pearl,You took Patrick to a hypnotist?,,You took Patrick to a hypnotist?,09,13,Barnacle Face,16-Sep-11,10
156,SpongeBob,No. The barnacle. It became convinced it was a pelican and flew south for the winter. We never saw that pelican again.,,No. The barnacle. It became convinced it was a pelican and flew south for the winter. We never saw that pelican again.,09,13,Barnacle Face,16-Sep-11,10
157,Pearl,I thought you said it was a barnacle.,,I thought you said it was a barnacle.,09,13,Barnacle Face,16-Sep-11,10
158,SpongeBob,What did I say?,,What did I say?,09,13,Barnacle Face,16-Sep-11,10
159,Pearl,Pelican.,,Pelican.,09,13,Barnacle Face,16-Sep-11,10
160,SpongeBob, He was a really good hypnotist.,pauses for a second,[pauses for a second] He was a really good hypnotist.,09,13,Barnacle Face,16-Sep-11,10
161,SpongeBob,Now just remain calm and it's all over before you know it.,,Now just remain calm and it's all over before you know it.,09,13,Barnacle Face,16-Sep-11,10
162,Pearl,Are you really going to use hypnosis to get rid of the... barnacle?,,Are you really going to use hypnosis to get rid of the... barnacle?,09,13,Barnacle Face,16-Sep-11,10
163,SpongeBob, Hypnosis? No! Hold still now. ,laughing hits the barnacle,[laughing] Hypnosis? No! Hold still now. [hits the barnacle],09,13,Barnacle Face,16-Sep-11,10
164,Pearl,Is everything okay?,,Is everything okay?,09,13,Barnacle Face,16-Sep-11,10
165,SpongeBob, I don't think this is going to work.  This ol' weather beaten shovel is gonna do the work! ,shows broken spatula Brings in a shovel hits the barnacle,[shows broken spatula] I don't think this is going to work. [Brings in a shovel] This ol' weather beaten shovel is gonna do the work! [hits the barnacle],09,13,Barnacle Face,16-Sep-11,10
166,Pearl,Did it come off?,,Did it come off?,09,13,Barnacle Face,16-Sep-11,10
167,SpongeBob, Gettin' there.,the shovel is stuck in his head,[the shovel is stuck in his head] Gettin' there.,09,13,Barnacle Face,16-Sep-11,10
168,Pearl,"SpongeBob, how much longer?",,"SpongeBob, how much longer?",09,13,Barnacle Face,16-Sep-11,10
169,SpongeBob,"Oh... shouldn't be too much longer.  Personally, you could take a break off if you'd like.",the jackhammer disintegrates,"Oh... shouldn't be too much longer. [the jackhammer disintegrates] Personally, you could take a break off if you'd like.",09,13,Barnacle Face,16-Sep-11,10
170,Pearl,Good idea. I'm going to scrub my face with some soap and water.,,Good idea. I'm going to scrub my face with some soap and water.,09,13,Barnacle Face,16-Sep-11,10
171,SpongeBob,Okay. ,"he throws the jackhammer aside, which lands in a pile of other broken tools","Okay. [he throws the jackhammer aside, which lands in a pile of other broken tools]",09,13,Barnacle Face,16-Sep-11,10
172,SpongeBob," Pearl!  Pearl, what happened?",walks into the bathroom Pearl is seen with soap covering her face,"[walks into the bathroom] Pearl! [Pearl is seen with soap covering her face] Pearl, what happened?",09,13,Barnacle Face,16-Sep-11,10
173,Pearl,There's more! ,"the soap slides off her face, exposing lots of barnacles everywhere","There's more! [the soap slides off her face, exposing lots of barnacles everywhere]",09,13,Barnacle Face,16-Sep-11,10
174,SpongeBob," I mean, you're right. There's more.",shrieks,"[shrieks] I mean, you're right. There's more.",09,13,Barnacle Face,16-Sep-11,10
175,Pearl, All I did was wash with soap and water!,puzzled,[puzzled] All I did was wash with soap and water!,09,13,Barnacle Face,16-Sep-11,10
176,SpongeBob, Hmm... Water and... this soap?,examines the soap,[examines the soap] Hmm... Water and... this soap?,09,13,Barnacle Face,16-Sep-11,10
177,Pearl,"Yes, but why?",,"Yes, but why?",09,13,Barnacle Face,16-Sep-11,10
178,SpongeBob," Because this soap smells so wonderful! That's why. Hmm, I know this fragrance from somewhere.  Oh, I'm sorry, did you want a whiff?",sniffs the bar of soap keeps sniffing the soap,"[sniffs the bar of soap] Because this soap smells so wonderful! That's why. Hmm, I know this fragrance from somewhere. [keeps sniffing the soap] Oh, I'm sorry, did you want a whiff?",09,13,Barnacle Face,16-Sep-11,10
179,Pearl,No.,,No.,09,13,Barnacle Face,16-Sep-11,10
180,SpongeBob, More for me!,continues sniffing,[continues sniffing] More for me!,09,13,Barnacle Face,16-Sep-11,10
181,SpongeBob," No, I think one jar of concealing cream is enough. Don't worry, Pearl, no one will notice a thing. ",holding the jar of cream Mr. Krabs enters the house with the groceries,"[holding the jar of cream] No, I think one jar of concealing cream is enough. Don't worry, Pearl, no one will notice a thing. [Mr. Krabs enters the house with the groceries]",09,13,Barnacle Face,16-Sep-11,10
182,Mr. Krabs," Pearl, I'm home! ",humming screams loudly,"[humming] Pearl, I'm home! [screams loudly]",09,13,Barnacle Face,16-Sep-11,10
183,SpongeBob,"Something wrong, Mr. Krabs?",,"Something wrong, Mr. Krabs?",09,13,Barnacle Face,16-Sep-11,10
184,Mr. Krabs,"For a second there, I thought a towering, hideous, mind-boggling abomination was standing here, staring at me in my own living room! But then I realized...  it's only my old, beloved daughter, Pearl.  Oh, Pearl. No, no, no need for these expensive trips to the spa. But don't worry, SpongeBob here will take care of it. I have more important measures to take care of.  Me jewels!",sweetly Pearl mumbles again Mr. Krabs walks over to a safe full of diamonds and jumps in,"For a second there, I thought a towering, hideous, mind-boggling abomination was standing here, staring at me in my own living room! But then I realized... [sweetly] it's only my old, beloved daughter, Pearl. [Pearl mumbles again] Oh, Pearl. No, no, no need for these expensive trips to the spa. But don't worry, SpongeBob here will take care of it. I have more important measures to take care of. [Mr. Krabs walks over to a safe full of diamonds and jumps in] Me jewels!",09,13,Barnacle Face,16-Sep-11,10
185,SpongeBob,"Pearl?  Pearl, you've been in the bathroom crying for three hours now. You can't stay in there forever.",knocks on the bathroom door,"Pearl? [knocks on the bathroom door] Pearl, you've been in the bathroom crying for three hours now. You can't stay in there forever.",09,13,Barnacle Face,16-Sep-11,10
186,Pearl, I'm not going to the dance!,from inside,[from inside] I'm not going to the dance!,09,13,Barnacle Face,16-Sep-11,10
187,SpongeBob,"Okay, I'm coming in!  Look at the bright side, Pearl. At least you can still play the piano.","opens the door, which causes a flood of tears to gush out into the hallway. SpongeBob swims against the current and makes it in","Okay, I'm coming in! [opens the door, which causes a flood of tears to gush out into the hallway. SpongeBob swims against the current and makes it in] Look at the bright side, Pearl. At least you can still play the piano.",09,13,Barnacle Face,16-Sep-11,10
188,Pearl,And what exactly would that do to me?,,And what exactly would that do to me?,09,13,Barnacle Face,16-Sep-11,10
189,SpongeBob,"I have no idea.  Don't worry, Pearl. I'll fix your crying!",Pearl bawls,"I have no idea. [Pearl bawls] Don't worry, Pearl. I'll fix your crying!",09,13,Barnacle Face,16-Sep-11,10
190,Pearl,How?,,How?,09,13,Barnacle Face,16-Sep-11,10
191,SpongeBob,"Well, I'm sure if I'll think strong enough, something will pop up.  Oops, I didn't mean it like that.  Hey, it's that delicious-smelling soap again. ","something DOES pop up, and it's more barnacles sees the bar of soap and picks it up starts sniffing the soap again","Well, I'm sure if I'll think strong enough, something will pop up. [something DOES pop up, and it's more barnacles] Oops, I didn't mean it like that. [sees the bar of soap and picks it up] Hey, it's that delicious-smelling soap again. [starts sniffing the soap again]",09,13,Barnacle Face,16-Sep-11,10
192,Pearl,,snatches it away,[snatches it away],09,13,Barnacle Face,16-Sep-11,10
193,SpongeBob,Okay. Where do you keep your soap?,,Okay. Where do you keep your soap?,09,13,Barnacle Face,16-Sep-11,10
194,Pearl,"In the basement. Duh, where else? ",scrubs her face more,"In the basement. Duh, where else? [scrubs her face more]",09,13,Barnacle Face,16-Sep-11,10
195,SpongeBob, Hello?  Something there? Pearl?!  Mr. Krabs!,"echoes SpongeBob jumps when he hears the echo, but keeps going until he hears another noise and turns around His torch goes out, making it completely dark. SpongeBob sees a door opening and goes through it to find Mr. Krabs, trying to pull a stuck handle","[echoes] Hello? [SpongeBob jumps when he hears the echo, but keeps going until he hears another noise and turns around] Something there? Pearl?! [His torch goes out, making it completely dark. SpongeBob sees a door opening and goes through it to find Mr. Krabs, trying to pull a stuck handle] Mr. Krabs!",09,13,Barnacle Face,16-Sep-11,10
196,Mr. Krabs,"Don't just stand there, boy! Come help me with this!  There we go. Sometimes it just gets a little stuck.",they both pull at the handle until it moves,"Don't just stand there, boy! Come help me with this! [they both pull at the handle until it moves] There we go. Sometimes it just gets a little stuck.",09,13,Barnacle Face,16-Sep-11,10
197,SpongeBob,"Mr. Krabs, what is this thing?",,"Mr. Krabs, what is this thing?",09,13,Barnacle Face,16-Sep-11,10
198,Mr. Krabs,"Why, it's my old soap press!",,"Why, it's my old soap press!",09,13,Barnacle Face,16-Sep-11,10
199,SpongeBob,Soap press?,,Soap press?,09,13,Barnacle Face,16-Sep-11,10
200,Mr. Krabs,"That's right! All the soap Pearl and I use comes from this machine. And the best part is, it runs on 100% pure leftover Krabby Patties!",,"That's right! All the soap Pearl and I use comes from this machine. And the best part is, it runs on 100% pure leftover Krabby Patties!",09,13,Barnacle Face,16-Sep-11,10
201,SpongeBob,Leftover Krabby Patties?,,Leftover Krabby Patties?,09,13,Barnacle Face,16-Sep-11,10
202,Mr. Krabs," Their precious essences are harvested, and after a brief cooling process, tumble out this conveyor belt as fresh, wonderful bars of soap!  Fresh and invigorating! Plus, it's absolutely free.",tosses a Krabby Patty into the machine the new soap falls off the conveyor belt into a basket,"[tosses a Krabby Patty into the machine] Their precious essences are harvested, and after a brief cooling process, tumble out this conveyor belt as fresh, wonderful bars of soap! [the new soap falls off the conveyor belt into a basket] Fresh and invigorating! Plus, it's absolutely free.",09,13,Barnacle Face,16-Sep-11,10
203,SpongeBob," Ohhhh, that explains why it smells so familiar! I don't know about this, Mr. Krabs. If Pearl finds out that you...",picks up one of the soap bars and sniffs it,"[picks up one of the soap bars and sniffs it] Ohhhh, that explains why it smells so familiar! I don't know about this, Mr. Krabs. If Pearl finds out that you...",09,13,Barnacle Face,16-Sep-11,10
204,Pearl, I've been using soap made out of Krabby Patties?,lividly,[lividly] I've been using soap made out of Krabby Patties?,09,13,Barnacle Face,16-Sep-11,10
205,Mr. Krabs,Krabby Patty essence.,,Krabby Patty essence.,09,13,Barnacle Face,16-Sep-11,10
206,Pearl,That's grease!,,That's grease!,09,13,Barnacle Face,16-Sep-11,10
207,Mr. Krabs,"Well, if you want to split hairs, I suppose-",,"Well, if you want to split hairs, I suppose-",09,13,Barnacle Face,16-Sep-11,10
208,Pearl, Daddy! ,furiously throws soap at her father,[furiously] Daddy! [throws soap at her father],09,13,Barnacle Face,16-Sep-11,10
209,Mr. Krabs," Got to go, you kids have fun!",runs away in fear,"[runs away in fear] Got to go, you kids have fun!",09,13,Barnacle Face,16-Sep-11,10
210,Pearl, I'm never gonna be able to get these barnacles off! My young life is ruined forever.,bursts into tears and rubs her eyes making squeaky sounds,[bursts into tears and rubs her eyes making squeaky sounds] I'm never gonna be able to get these barnacles off! My young life is ruined forever.,09,13,Barnacle Face,16-Sep-11,10
211,SpongeBob,"Don't worry, Pearl. I said I'm not going to let Mr. Krabs down, and I'm not going to. What do you think of that?",,"Don't worry, Pearl. I said I'm not going to let Mr. Krabs down, and I'm not going to. What do you think of that?",09,13,Barnacle Face,16-Sep-11,10
212,Pearl," The Bikini Bottom High School Dance was supposed to be my chance to sparkle, my-",wails,"[wails] The Bikini Bottom High School Dance was supposed to be my chance to sparkle, my-",09,13,Barnacle Face,16-Sep-11,10
213,SpongeBob,"Wait a minute, Pearl, say that again!",,"Wait a minute, Pearl, say that again!",09,13,Barnacle Face,16-Sep-11,10
214,Pearl,Okay. The Bikini Bottom High School Dance was supposed to be my chance to sparkle.,,Okay. The Bikini Bottom High School Dance was supposed to be my chance to sparkle.,09,13,Barnacle Face,16-Sep-11,10
215,SpongeBob,"Okay, you can stop. I think I have an idea...",,"Okay, you can stop. I think I have an idea...",09,13,Barnacle Face,16-Sep-11,10
216,Pearl,Are you done yet?,,Are you done yet?,09,13,Barnacle Face,16-Sep-11,10
217,SpongeBob," All set! Close your eyes and get ready to sparkle! One, two, three.  And, ta-da. What do you think?",climbs down the ladder turns Pearl's chair to face the mirror. Pearl has blue diamonds on her face to hide her barnacles,"[climbs down the ladder] All set! Close your eyes and get ready to sparkle! One, two, three. [turns Pearl's chair to face the mirror. Pearl has blue diamonds on her face to hide her barnacles] And, ta-da. What do you think?",09,13,Barnacle Face,16-Sep-11,10
218,Pearl,"I don't know, SpongeBob - what would my friends say?",,"I don't know, SpongeBob - what would my friends say?",09,13,Barnacle Face,16-Sep-11,10
219,SpongeBob, We shall see shortly.,walks her to the living room,[walks her to the living room] We shall see shortly.,09,13,Barnacle Face,16-Sep-11,10
220,Pearl,Are you sure?,,Are you sure?,09,13,Barnacle Face,16-Sep-11,10
221,SpongeBob, Shh. Trust me.,opens the front door,[opens the front door] Shh. Trust me.,09,13,Barnacle Face,16-Sep-11,10
222,Blue fish,"Pearl, we're here to pick you up to the- wow! Pearl, you look amazing!",,"Pearl, we're here to pick you up to the- wow! Pearl, you look amazing!",09,13,Barnacle Face,16-Sep-11,10
223,Pearl,I do?,,I do?,09,13,Barnacle Face,16-Sep-11,10
224,Blue fish,"Well, not amazing. Sparkly and shiny and amazing!",,"Well, not amazing. Sparkly and shiny and amazing!",09,13,Barnacle Face,16-Sep-11,10
225,Pearl,Whee! To the Bikini Bottom High School Dance!,,Whee! To the Bikini Bottom High School Dance!,09,13,Barnacle Face,16-Sep-11,10
226,Pearl and her friends, Let's go! ,"laughing they run out of the house, and SpongeBob shuts the door behind them","[laughing] Let's go! [they run out of the house, and SpongeBob shuts the door behind them]",09,13,Barnacle Face,16-Sep-11,10
227,SpongeBob,"You have a good time, carefree teens!",,"You have a good time, carefree teens!",09,13,Barnacle Face,16-Sep-11,10
228,Mr. Krabs," My jewels! SpongeBob, my entire collection of precious jewels is gone! Seen it?",screams and exits his jewel safe,"[screams and exits his jewel safe] My jewels! SpongeBob, my entire collection of precious jewels is gone! Seen it?",09,13,Barnacle Face,16-Sep-11,10
229,SpongeBob,Of course! Pearl's wearing it to the Bikini Bottom High School Dance!,,Of course! Pearl's wearing it to the Bikini Bottom High School Dance!,09,13,Barnacle Face,16-Sep-11,10
230,Mr. Krabs,Help! Police! Thief!  Stop that whale!,"runs out of the house, running through the door","Help! Police! Thief! [runs out of the house, running through the door] Stop that whale!",09,13,Barnacle Face,16-Sep-11,10
231,SpongeBob,"I promised Mr. Krabs I wouldn't let him down, and I have partially fulfilled that promise.",,"I promised Mr. Krabs I wouldn't let him down, and I have partially fulfilled that promise.",09,13,Barnacle Face,16-Sep-11,10
232,Squidward," SpongeBob, why aren't those orders up yet? . SpongeBob, the collective blood sugar around here is dangerously low.  Why are you grilling index cards? ",whispers with clenched teeth Cut to the scene where we see two fishes with forks and knives and they're moaning like zombies. Squidward is stunned by this. Scene cuts to the kitchen. He pokes his head through the window looks down on the grill to see some cards on it close up to the index cards that talks about boating school,"[whispers with clenched teeth] SpongeBob, why aren't those orders up yet? [Cut to the scene where we see two fishes with forks and knives and they're moaning like zombies. Squidward is stunned by this. Scene cuts to the kitchen. He pokes his head through the window]. SpongeBob, the collective blood sugar around here is dangerously low. [looks down on the grill to see some cards on it] Why are you grilling index cards? [close up to the index cards that talks about boating school]",09,04,Oral Report,4-Jun-11,10
233,SpongeBob,"Sorry, Squidward, I got a little distracted.  I'm practicing for my oral report for Boating School tomorrow.",holding up an index card,"Sorry, Squidward, I got a little distracted. [holding up an index card] I'm practicing for my oral report for Boating School tomorrow.",09,04,Oral Report,4-Jun-11,10
234,Squidward,"You know, SpongeBob, statistics show that public speaking is the number three cause of stress right behind death and marriage. Now get those orders ready!",,"You know, SpongeBob, statistics show that public speaking is the number three cause of stress right behind death and marriage. Now get those orders ready!",09,04,Oral Report,4-Jun-11,10
235,SpongeBob,"Okay! Okay!  Hm, what's so scary about public speaking anyway? You just stand in front of the public and speak publicly. It's really no different to what I do everyday.",takes off his hat and shoves out seven patties from inside it,"Okay! Okay! [takes off his hat and shoves out seven patties from inside it] Hm, what's so scary about public speaking anyway? You just stand in front of the public and speak publicly. It's really no different to what I do everyday.",09,04,Oral Report,4-Jun-11,10
