id,speaker,speech,context,raw-dialouge,season,episode,title,airdate,runtime
2582,Plankton," Good morning, sir! My name is Sheldon R. Shellcleaner, owner and operator of Super Shell Cleaner Vacations Unlimited. Can I ask you a question? Are you tired of your dirty shell resulting in tireless hours of...",In a disguise wearing a wig and has a suitcase,"[In a disguise wearing a wig and has a suitcase] Good morning, sir! My name is Sheldon R. Shellcleaner, owner and operator of Super Shell Cleaner Vacations Unlimited. Can I ask you a question? Are you tired of your dirty shell resulting in tireless hours of...",08,08,Shellback Shenanigans,18-Sep-10,10
2583,SpongeBob, Gary! I'm going to start the bath!,Offscreen,[Offscreen] Gary! I'm going to start the bath!,08,08,Shellback Shenanigans,18-Sep-10,10
2584,Plankton,"Look, I'll just cut to the chase. Do you have a dirty shell and hate bath time?",,"Look, I'll just cut to the chase. Do you have a dirty shell and hate bath time?",08,08,Shellback Shenanigans,18-Sep-10,10
2585,Gary,Meow.,,Meow.,08,08,Shellback Shenanigans,18-Sep-10,10
2586,Plankton,"Of course you do! That's why I must tell you about our limited time offer. For not 4, not 3, but 1 luxurious night here! At Club Shell! A perfect resort for snails. Don't try to pinch yourself, this could be...",Opens suitcase and a large poster pops out,"Of course you do! That's why I must tell you about our limited time offer. For not 4, not 3, but 1 luxurious night here![Opens suitcase and a large poster pops out] At Club Shell! A perfect resort for snails. Don't try to pinch yourself, this could be...",08,08,Shellback Shenanigans,18-Sep-10,10
2587,SpongeBob, Gary! The bath is ready!,offscreen,[offscreen] Gary! The bath is ready!,08,08,Shellback Shenanigans,18-Sep-10,10
2588,Plankton,"...all yours! Now I know what you're thinking, but I got you covered!  A temporary shell will be provided for you to wear while yours is being cleaned, and all of this is free of charge, of course.",Shows Gary an orange inflatable shell,"...all yours! Now I know what you're thinking, but I got you covered! [Shows Gary an orange inflatable shell] A temporary shell will be provided for you to wear while yours is being cleaned, and all of this is free of charge, of course.",08,08,Shellback Shenanigans,18-Sep-10,10
2589,SpongeBob, Gary! Your bath is ready!,offscreen,[offscreen] Gary! Your bath is ready!,08,08,Shellback Shenanigans,18-Sep-10,10
2590,Plankton,"Have a pleasant stay! Bon voyage!  If my reasoning is correct, as SpongeBob's pet, I'll get to witness Krabby Patties being made from scratch! Then I can copy the formula and destroy Krabs once and for all!","Closes the door and takes off the disguise, goes into Gary's real shell, and puts small balls on his antennas, making him look like Gary. He laughs","Have a pleasant stay! Bon voyage! [Closes the door and takes off the disguise, goes into Gary's real shell, and puts small balls on his antennas, making him look like Gary. He laughs] If my reasoning is correct, as SpongeBob's pet, I'll get to witness Krabby Patties being made from scratch! Then I can copy the formula and destroy Krabs once and for all!",08,08,Shellback Shenanigans,18-Sep-10,10
2591,SpongeBob," Ah-ha, there you are, Gare-Bear!  Oh, you naughty little snail hiding from me! I'm gonna give you a real good scrubbing. You have to be sparkly clean for ""Bring your pet to work"" day! And today is the day!  First, I'm gonna start you off with a yummy smelling shower gel!","Appears walking next to Plankton in the shell and mistakes him for Gary Picks him up and walks up the stairs Goes to the bath tub and drops ""Gary"" in the tub","[Appears walking next to Plankton in the shell and mistakes him for Gary] Ah-ha, there you are, Gare-Bear! [Picks him up and walks up the stairs] Oh, you naughty little snail hiding from me! I'm gonna give you a real good scrubbing. You have to be sparkly clean for ""Bring your pet to work"" day! And today is the day! [Goes to the bath tub and drops ""Gary"" in the tub] First, I'm gonna start you off with a yummy smelling shower gel!",08,08,Shellback Shenanigans,18-Sep-10,10
2592,Plankton,Wha...? ,Gets squirted with the gel and is covered in shampoo,Wha...? [Gets squirted with the gel and is covered in shampoo],08,08,Shellback Shenanigans,18-Sep-10,10
2593,SpongeBob,"Oh, smells nice, doesn't it?",,"Oh, smells nice, doesn't it?",08,08,Shellback Shenanigans,18-Sep-10,10
2594,Plankton,Ugh...,,Ugh...,08,08,Shellback Shenanigans,18-Sep-10,10
2595,SpongeBob, Prepare yourself for the scrubbing of a lifetime! ,"Takes ""Gary"" and holds him above his head Scrubs Plankton by dragging him back and forth like a sponge","[Takes ""Gary"" and holds him above his head] Prepare yourself for the scrubbing of a lifetime! [Scrubs Plankton by dragging him back and forth like a sponge]",08,08,Shellback Shenanigans,18-Sep-10,10
2596,Plankton,,screams,[screams],08,08,Shellback Shenanigans,18-Sep-10,10
2597,SpongeBob," Bet that feels good, huh?",Stops scrubbing him,"[Stops scrubbing him] Bet that feels good, huh?",08,08,Shellback Shenanigans,18-Sep-10,10
2598,Plankton, Curses! I mean... meow?,Coughs and Chokes,[Coughs and Chokes] Curses! I mean... meow?,08,08,Shellback Shenanigans,18-Sep-10,10
2599,SpongeBob," Gary, are you sure you're feeling alright?",Nervous,"[Nervous] Gary, are you sure you're feeling alright?",08,08,Shellback Shenanigans,18-Sep-10,10
2600,Plankton,"I've never felt better! Uh, I mean... meow! ",Soap washes off and reveals his body to SpongeBob,"I've never felt better! Uh, I mean... meow! [Soap washes off and reveals his body to SpongeBob]",08,08,Shellback Shenanigans,18-Sep-10,10
2601,SpongeBob, Gary! You're turning green! And talking!,Worried,[Worried] Gary! You're turning green! And talking!,08,08,Shellback Shenanigans,18-Sep-10,10
2602,Plankton,"No, I'm not.",,"No, I'm not.",08,08,Shellback Shenanigans,18-Sep-10,10
2603,SpongeBob, We gotta get you to the pet hospital!,"Rushes down the stairs holding ""Gary""","[Rushes down the stairs holding ""Gary""] We gotta get you to the pet hospital!",08,08,Shellback Shenanigans,18-Sep-10,10
2604,Plankton,"Pet hospital?! But what about the fresh batch of Krabby Patties?! I mean, meow!",,"Pet hospital?! But what about the fresh batch of Krabby Patties?! I mean, meow!",08,08,Shellback Shenanigans,18-Sep-10,10
2605,SpongeBob,"You're right! I'll call Mr. Krabs and tell him I'm gonna be late. Gary, you're a lot more talkative when you're sick.  Excuse me, nurse. My snail has been talking and turning green. Is he sick?",Bubbles change the scene showing the hospital. To Sadie,"You're right! I'll call Mr. Krabs and tell him I'm gonna be late. Gary, you're a lot more talkative when you're sick. [Bubbles change the scene showing the hospital. To Sadie] Excuse me, nurse. My snail has been talking and turning green. Is he sick?",08,08,Shellback Shenanigans,18-Sep-10,10
2606,Plankton, Meow? ,Afraid she might notice it's him Sadie throws bottles of medicine on the ceiling while shrieking in horror,[Afraid she might notice it's him] Meow? [Sadie throws bottles of medicine on the ceiling while shrieking in horror],08,08,Shellback Shenanigans,18-Sep-10,10
2607,SpongeBob,Is that yes? Or no?,,Is that yes? Or no?,08,08,Shellback Shenanigans,18-Sep-10,10
2608,Sadie,I have never seen such a drastic case! Rush this snail to the intensive care unit stat!,,I have never seen such a drastic case! Rush this snail to the intensive care unit stat!,08,08,Shellback Shenanigans,18-Sep-10,10
2609,Plankton,Intensive care unit?,,Intensive care unit?,08,08,Shellback Shenanigans,18-Sep-10,10
2610,SpongeBob,"Don't worry, Gary. These are professionals.",,"Don't worry, Gary. These are professionals.",08,08,Shellback Shenanigans,18-Sep-10,10
2611,Plankton," Karen! Oh, sorry. I thought you were someone else.","Sees a large computer, thinking it's Karen","[Sees a large computer, thinking it's Karen] Karen! Oh, sorry. I thought you were someone else.",08,08,Shellback Shenanigans,18-Sep-10,10
2612,Sadie, Don't worry. We're just going to subject you to a series of invasive tests. It'll be over before you know it. ,"Walks in the room She pulls a curtains and we hear Plankton screaming in pain while the screen shows the hospital. SpongeBob breathes heavily thinking about ""Gary""","[Walks in the room] Don't worry. We're just going to subject you to a series of invasive tests. It'll be over before you know it. [She pulls a curtains and we hear Plankton screaming in pain while the screen shows the hospital. SpongeBob breathes heavily thinking about ""Gary""]",08,08,Shellback Shenanigans,18-Sep-10,10
2613,Jennifer-Millie,"Sir, all the doctor is saying is that your snail is still in the intensive care unit, and we just need to run a couple more tests.",,"Sir, all the doctor is saying is that your snail is still in the intensive care unit, and we just need to run a couple more tests.",08,08,Shellback Shenanigans,18-Sep-10,10
2614,Purple Doctorfish, That's not what I'm saying at all.,To Jennifer,[To Jennifer] That's not what I'm saying at all.,08,08,Shellback Shenanigans,18-Sep-10,10
2615,SpongeBob,"Oh, Gary! ",crying,"Oh, Gary! [crying]",08,08,Shellback Shenanigans,18-Sep-10,10
2616,Purple Doctorfish," Yes, I'll be honest with you, son, we've tried everything we can. We just can't find out anything wrong with him. I've never seen anything like it.",To SpongeBob,"[To SpongeBob] Yes, I'll be honest with you, son, we've tried everything we can. We just can't find out anything wrong with him. I've never seen anything like it.",08,08,Shellback Shenanigans,18-Sep-10,10
2617,SpongeBob,"Please try to save him, doctor!",,"Please try to save him, doctor!",08,08,Shellback Shenanigans,18-Sep-10,10
2618,Plankton, No! No more! Please! I-I-I-I...,"Sleeps on the bed, then wakes up paranoid","[Sleeps on the bed, then wakes up paranoid] No! No more! Please! I-I-I-I...",08,08,Shellback Shenanigans,18-Sep-10,10
2619,Sadie,"Relax, Gary, the tests are over. I'm just here to give you a little pill.",,"Relax, Gary, the tests are over. I'm just here to give you a little pill.",08,08,Shellback Shenanigans,18-Sep-10,10
2620,Plankton,Whew! That's a relief.,,Whew! That's a relief.,08,08,Shellback Shenanigans,18-Sep-10,10
2621,Sadie," Now, open wide. ",Takes out a giant pill bigger than Plankton Plankton screams as Sadie puts the pill in his mouth,"[Takes out a giant pill bigger than Plankton] Now, open wide. [Plankton screams as Sadie puts the pill in his mouth]",08,08,Shellback Shenanigans,18-Sep-10,10
2622,Sadie,"That wasn't so bad, was it?  That's not good.  Uh, Mr. SquarePants?","Plankton has the pill in his mouth, tears up, and spits out the pill all over her Cuts to SpongeBob still crying","That wasn't so bad, was it? [Plankton has the pill in his mouth, tears up, and spits out the pill all over her] That's not good. [Cuts to SpongeBob still crying] Uh, Mr. SquarePants?",08,08,Shellback Shenanigans,18-Sep-10,10
2623,SpongeBob, Gary!,"stops crying and heads over to ""Gary"" who is covered up in bandages","[stops crying and heads over to ""Gary"" who is covered up in bandages] Gary!",08,08,Shellback Shenanigans,18-Sep-10,10
2624,Sadie,The doctor says there's nothing more we can do. It's best to take him home and let nature take its course.,,The doctor says there's nothing more we can do. It's best to take him home and let nature take its course.,08,08,Shellback Shenanigans,18-Sep-10,10
2625,SpongeBob,"You're- you're saying that he's... that he might... oh.  Nurse? Nurse?! Oh, well, Gary, this looks like it might be...... the end. ",Sadie walks away sniff wails,"You're- you're saying that he's... that he might... oh. [Sadie walks away] Nurse? Nurse?! Oh, well, Gary, this looks like it might be...[sniff]... the end. [wails]",08,08,Shellback Shenanigans,18-Sep-10,10
2626,Plankton,If I could just have a...  Krabby Patty before I go...,cough cough,If I could just have a... [cough cough] Krabby Patty before I go...,08,08,Shellback Shenanigans,18-Sep-10,10
2627,SpongeBob,"Sure thing, little buddy, sure.  Y'know, it's... it's really poignant.",sniffs,"Sure thing, little buddy, sure. [sniffs] Y'know, it's... it's really poignant.",08,08,Shellback Shenanigans,18-Sep-10,10
2628,Plankton,What is?,,What is?,08,08,Shellback Shenanigans,18-Sep-10,10
2629,SpongeBob,"Well, now that you can talk, we're... we're running out of time to say I love you! ",continues wailing and crying,"Well, now that you can talk, we're... we're running out of time to say I love you! [continues wailing and crying]",08,08,Shellback Shenanigans,18-Sep-10,10
2630,Plankton," Oh, boy...",sighs,"[sighs] Oh, boy...",08,08,Shellback Shenanigans,18-Sep-10,10
2631,Tourist,"So, once again, we'd like to thank you for choosing Club Shell, and we hope to see you again real soon.",,"So, once again, we'd like to thank you for choosing Club Shell, and we hope to see you again real soon.",08,08,Shellback Shenanigans,18-Sep-10,10
2632,SpongeBob," Just a little further, Gare-Bare.","Carrying ""Gary""","[Carrying ""Gary""] Just a little further, Gare-Bare.",08,08,Shellback Shenanigans,18-Sep-10,10
2633,Gary,,Looks out window,[Looks out window],08,08,Shellback Shenanigans,18-Sep-10,10
2634,Plankton,Yes!,,Yes!,08,08,Shellback Shenanigans,18-Sep-10,10
2635,SpongeBob," Buddy, you just stay right here, and Daddy's gonna go get the secret formula and whip you up the best batch that we ever whipped up. Be right back, Gare-Bear. ","Puts ""Gary"" down on the floor next to the grill Walks away gloomily","[Puts ""Gary"" down on the floor next to the grill] Buddy, you just stay right here, and Daddy's gonna go get the secret formula and whip you up the best batch that we ever whipped up. Be right back, Gare-Bear. [Walks away gloomily]",08,08,Shellback Shenanigans,18-Sep-10,10
2636,Plankton,"Yes, SpongeFool, come right back with your complete undoing and victory will be mine!",,"Yes, SpongeFool, come right back with your complete undoing and victory will be mine!",08,08,Shellback Shenanigans,18-Sep-10,10
2637,Plankton,"Mommy? Hey, wait!",,"Mommy? Hey, wait!",08,08,Shellback Shenanigans,18-Sep-10,10
2638,Mr. Krabs,Plankton? ,"Finds out Gary beat him out of the restaurant and has an idea. Bubbles change the scene. Gary is at the Krusty Krab door letting people in, then Plankton, in a costume, comes up to Gary","Plankton? [Finds out Gary beat him out of the restaurant and has an idea. Bubbles change the scene. Gary is at the Krusty Krab door letting people in, then Plankton, in a costume, comes up to Gary]",08,08,Shellback Shenanigans,18-Sep-10,10
2639,Plankton,"Good day, sir. I'm just here to sample some of your delicious Krabby fare.  Whoa, there, fido!  I'm going! I'm going already!",Gary Growls screams and runs away,"Good day, sir. I'm just here to sample some of your delicious Krabby fare. [Gary Growls] Whoa, there, fido! [screams and runs away] I'm going! I'm going already!",08,08,Shellback Shenanigans,18-Sep-10,10
2640,SpongeBob,"Wow, Gary's doing a great job as bouncer, huh, Mr. Krabs? Really earning his pay.",,"Wow, Gary's doing a great job as bouncer, huh, Mr. Krabs? Really earning his pay.",08,08,Shellback Shenanigans,18-Sep-10,10
2641,Mr. Krabs,"Well, he takes after you, boy.  Pay?!",surprised,"Well, he takes after you, boy. [surprised] Pay?!",08,08,Shellback Shenanigans,18-Sep-10,10
4390,SpongeBob,"♪Oh, I've got an whole new attitude♪",,"♪Oh, I've got an whole new attitude♪",08,18,Sponge-Cano!,28-Jan-11,10
4391,Squidward,"Oh, is that supposed to be singing?  I am putting that one on SpongeBob.  Would you clam up, SpongeBob? I am trying to paint in here!",paint brushes fall on the floor to SpongeBob,"Oh, is that supposed to be singing? [paint brushes fall on the floor] I am putting that one on SpongeBob. [to SpongeBob] Would you clam up, SpongeBob? I am trying to paint in here!",08,18,Sponge-Cano!,28-Jan-11,10
4392,SpongeBob,♪I cherish my fellow residents...♪,,♪I cherish my fellow residents...♪,08,18,Sponge-Cano!,28-Jan-11,10
4393,Squidward,"SpongeBob, why are you doing this?",,"SpongeBob, why are you doing this?",08,18,Sponge-Cano!,28-Jan-11,10
4394,SpongeBob,"Oh, I'm just displaying for all to see an attitude of gratitude!",,"Oh, I'm just displaying for all to see an attitude of gratitude!",08,18,Sponge-Cano!,28-Jan-11,10
4395,Squidward,Gratitude? You've been wallowing in filth all morning. What could you possibly be grateful for?,,Gratitude? You've been wallowing in filth all morning. What could you possibly be grateful for?,08,18,Sponge-Cano!,28-Jan-11,10
4396,SpongeBob,"Hit it, boys! ♪Oh, I've got an whole new attitude. A lifetime subscription to gratitude. Friend, you've got to change your latitude. Live an attitude of gratitude, I'm grateful for the life I'm living. Who knows how long I will have it? I'm thankful for all I've been given. We make appreciation a habit. There's no time like the present day to have a present come your way!",Slimy trash can monsters appear,"Hit it, boys! [Slimy trash can monsters appear]♪Oh, I've got an whole new attitude. A lifetime subscription to gratitude. Friend, you've got to change your latitude. Live an attitude of gratitude, I'm grateful for the life I'm living. Who knows how long I will have it? I'm thankful for all I've been given. We make appreciation a habit. There's no time like the present day to have a present come your way!",08,18,Sponge-Cano!,28-Jan-11,10
4397,Slimy trash can monsters,All you have to do it grab it!,,All you have to do it grab it!,08,18,Sponge-Cano!,28-Jan-11,10
4398,SpongeBob,So now I think that you will see.,,So now I think that you will see.,08,18,Sponge-Cano!,28-Jan-11,10
4399,Slimy trash can monsters,You'll see.,,You'll see.,08,18,Sponge-Cano!,28-Jan-11,10
4400,SpongeBob,"There's nothing more you need. My friend, this ain't no platitude.",,"There's nothing more you need. My friend, this ain't no platitude.",08,18,Sponge-Cano!,28-Jan-11,10
4401,Slimy trash can creatures,Platitude!,,Platitude!,08,18,Sponge-Cano!,28-Jan-11,10
4402,SpongeBob,Just an attitude of gratitude.♪,,Just an attitude of gratitude.♪,08,18,Sponge-Cano!,28-Jan-11,10
4403,Slimy trash can creatures,Gratitude!,,Gratitude!,08,18,Sponge-Cano!,28-Jan-11,10
4404,SpongeBob,"Or, in your case, Squidward, an attitude of hattitude! ",laughs,"Or, in your case, Squidward, an attitude of hattitude! [laughs]",08,18,Sponge-Cano!,28-Jan-11,10
4405,Squidward,Keep your hat and your gratitude! Because having you as a neighbor has left me with nothing to be grateful for! ,"slips on the paintbrushes and falls downstairs, bursting a pipe","Keep your hat and your gratitude! Because having you as a neighbor has left me with nothing to be grateful for! [slips on the paintbrushes and falls downstairs, bursting a pipe]",08,18,Sponge-Cano!,28-Jan-11,10
4406,SpongeBob,"Wow, Squidward, you should really consider getting your plumbing looked at.",,"Wow, Squidward, you should really consider getting your plumbing looked at.",08,18,Sponge-Cano!,28-Jan-11,10
4407,Squidward,This is your fault!,,This is your fault!,08,18,Sponge-Cano!,28-Jan-11,10
4408,SpongeBob,"Don't worry, buddy. I can give you a hand.",,"Don't worry, buddy. I can give you a hand.",08,18,Sponge-Cano!,28-Jan-11,10
4409,Squidward,"No, you have helped me enough. I don't want your help ever again!",,"No, you have helped me enough. I don't want your help ever again!",08,18,Sponge-Cano!,28-Jan-11,10
4410,SpongeBob,"No problem, pal. ",walks away,"No problem, pal. [walks away]",08,18,Sponge-Cano!,28-Jan-11,10
4411,Squidward,"Moron.  Stupid pipe!  Oh, great. Now I'm late for work.","uses his wrench to tighten the pipe, and tightens it up too much looks at watch","Moron. [uses his wrench to tighten the pipe, and tightens it up too much] Stupid pipe! [looks at watch] Oh, great. Now I'm late for work.",08,18,Sponge-Cano!,28-Jan-11,10
4412,Scooter,"Whoa! Slow down, Speedster! ",laughs,"Whoa! Slow down, Speedster! [laughs]",08,18,Sponge-Cano!,28-Jan-11,10
4413,Squidward,Go jump in a coral pit.,,Go jump in a coral pit.,08,18,Sponge-Cano!,28-Jan-11,10
4414,Mr. Krabs,"Mr. Squidward, how many times do I have to tell you? The customers' jokes are always funny! Now, give the gentlemen a chuckle.",,"Mr. Squidward, how many times do I have to tell you? The customers' jokes are always funny! Now, give the gentlemen a chuckle.",08,18,Sponge-Cano!,28-Jan-11,10
4415,Squidward,Ha ha ha.,,Ha ha ha.,08,18,Sponge-Cano!,28-Jan-11,10
4416,Scooter,"I knew you would eventually get it, dude. ",laughs. SpongeBob is looking at Squidward,"I knew you would eventually get it, dude. [laughs. SpongeBob is looking at Squidward]",08,18,Sponge-Cano!,28-Jan-11,10
4417,Squidward,"Stop staring, SpongeBob. You're affecting my productivity.",,"Stop staring, SpongeBob. You're affecting my productivity.",08,18,Sponge-Cano!,28-Jan-11,10
4418,Sandals,I would like to order one Krabby Patty.,,I would like to order one Krabby Patty.,08,18,Sponge-Cano!,28-Jan-11,10
4419,Squidward,That'll be three dollars.,,That'll be three dollars.,08,18,Sponge-Cano!,28-Jan-11,10
4420,Sandals, Do you accept pennies?,with many pennies,[with many pennies] Do you accept pennies?,08,18,Sponge-Cano!,28-Jan-11,10
4421,Squidward,I don't have time to count all that!,,I don't have time to count all that!,08,18,Sponge-Cano!,28-Jan-11,10
4422,Sandals,"Oh, well, have it your way. I'll just take my loose change elsewhere!",,"Oh, well, have it your way. I'll just take my loose change elsewhere!",08,18,Sponge-Cano!,28-Jan-11,10
4423,Squidward,"Oh, please do, I'm trying to get some work done here. Sheesh, some people just want to waste your time.  Hey, buddy! How am I supposed to focus with all of that incessant tapping? And what do you think you're doing, sir?",Fred is tapping his feet,"Oh, please do, I'm trying to get some work done here. Sheesh, some people just want to waste your time. [Fred is tapping his feet] Hey, buddy! How am I supposed to focus with all of that incessant tapping? And what do you think you're doing, sir?",08,18,Sponge-Cano!,28-Jan-11,10
4424,Nat,I'm holding the door for the nice lady.,,I'm holding the door for the nice lady.,08,18,Sponge-Cano!,28-Jan-11,10
4425,Squidward,"No, you're not. You're leaving your grubby finger prints all over the glass! And now yours truly is gonna have to clean it up! Why does everyone insist on making my job so difficult?!  You always leave trash on the table!  Your teeth chatter!  Your hat annoys me!  You take too long in the restroom!  And SpongeBob, would you quit singing that song?",to Dale to Mabel to orange fish with a hat to blue fish to SpongeBob,"No, you're not. You're leaving your grubby finger prints all over the glass! And now yours truly is gonna have to clean it up! Why does everyone insist on making my job so difficult?! [to Dale] You always leave trash on the table! [to Mabel] Your teeth chatter! [to orange fish with a hat] Your hat annoys me! [to blue fish] You take too long in the restroom! [to SpongeBob] And SpongeBob, would you quit singing that song?",08,18,Sponge-Cano!,28-Jan-11,10
4426,SpongeBob,"What's the matter, Squidward? Don't you have an attitude of gratitude?",,"What's the matter, Squidward? Don't you have an attitude of gratitude?",08,18,Sponge-Cano!,28-Jan-11,10
4427,Squidward," SpongeBob, I hate my job, and I live in a dead end town with neighbors I can't stand. I'm the most miserable person in Bikini Bottom! What do I have to be thankful for?",sighs,"[sighs] SpongeBob, I hate my job, and I live in a dead end town with neighbors I can't stand. I'm the most miserable person in Bikini Bottom! What do I have to be thankful for?",08,18,Sponge-Cano!,28-Jan-11,10
4428,SpongeBob,"Well, it could be worse.",,"Well, it could be worse.",08,18,Sponge-Cano!,28-Jan-11,10
4429,Squidward,How could life in Bikini Bottom possibly get any worse?,,How could life in Bikini Bottom possibly get any worse?,08,18,Sponge-Cano!,28-Jan-11,10
4430,Nat,Mount Bikini Bottom's erupting!,,Mount Bikini Bottom's erupting!,08,18,Sponge-Cano!,28-Jan-11,10
4431,SpongeBob,That's how.,,That's how.,08,18,Sponge-Cano!,28-Jan-11,10
4432,Lloyd,Cool.,,Cool.,08,18,Sponge-Cano!,28-Jan-11,10
4433,Scooter,"Look, the roof! ","lava and fire is burning down the Krusty Krab,and everyone runs around screaming","Look, the roof! [lava and fire is burning down the Krusty Krab,and everyone runs around screaming]",08,18,Sponge-Cano!,28-Jan-11,10
4434,Mr. Krabs,"Eh, ya lemmings. Afraid of a little lavar? CASHY! No! Make it stop raining fiery destruction! ",lava splashes on the cash register sobs,"Eh, ya lemmings. Afraid of a little lavar?[lava splashes on the cash register] CASHY! No! Make it stop raining fiery destruction! [sobs]",08,18,Sponge-Cano!,28-Jan-11,10
4435,SpongeBob,"Sorry to interrupt your crying, Mr. Krabs, but shouldn't we get to a place that at least doesn't have a roof with lava coming through it?  Fear not, shelter can't be far a-",everyone evacuates,"Sorry to interrupt your crying, Mr. Krabs, but shouldn't we get to a place that at least doesn't have a roof with lava coming through it? [everyone evacuates] Fear not, shelter can't be far a-",08,18,Sponge-Cano!,28-Jan-11,10
4436,Mr. Krabs,"Oh, why even bother, SpongeBob? Can't you see? Civilization as we know is crumbling to dust!  Civic orders is in tatters. It's every man for himself, there's no other way. I'm gonna need your life essence! ",a hideous close-up is shown grabs SpongeBob and Squidward,"Oh, why even bother, SpongeBob? Can't you see? Civilization as we know is crumbling to dust! [a hideous close-up is shown] Civic orders is in tatters. It's every man for himself, there's no other way. I'm gonna need your life essence! [grabs SpongeBob and Squidward]",08,18,Sponge-Cano!,28-Jan-11,10
