id,speaker,speech,context,raw-dialouge,season,episode,title,airdate,runtime
25427,SpongeBob," Hmm... There we go! Three Krabby Patties, two large Kelpy Colas, and three fries ready to be served.  Hmm?  Oops!  Sorry about that, Mr. Krabs! It's just so hard to get this food to Squidward without violating this restraining order. ","Walks in front of the dotted line Next scene to him cooking Krabby Patties and puts them on a long hand-made spatula made of wood and mops Tries to give Squidward the order but he puts up a glass window Carries the order on the hand-made spatula with stings and another piece of wood on the other side of Squidward also in front of the door. Mr. Krabs comes out, walks right into it and it knocks him on the ground Run over to Mr. Krabs Shows him the restraining order","[Walks in front of the dotted line] Hmm...[Next scene to him cooking Krabby Patties and puts them on a long hand-made spatula made of wood and mops] There we go! Three Krabby Patties, two large Kelpy Colas, and three fries ready to be served. [Tries to give Squidward the order but he puts up a glass window] Hmm? [Carries the order on the hand-made spatula with stings and another piece of wood on the other side of Squidward also in front of the door. Mr. Krabs comes out, walks right into it and it knocks him on the ground] Oops! [Run over to Mr. Krabs] Sorry about that, Mr. Krabs! It's just so hard to get this food to Squidward without violating this restraining order. [Shows him the restraining order]",09,31,Restraining SpongeBob,2-Apr-12,10
25428,Mr. Krabs,"Let me see that!  Thank you! Look, boy, I don't know what in coral cabins what a restraining order is, but I do know whatever's going on here clearly ain't working. Now I want this ship sailing smoothly! On the double! Or I'll be forced to remove more gold stars from your employee performance chart! ","Takes the restraining order and wipes the mustard off him, then gives it back to SpongeBob Takes away a star from SpongeBob's Employee Chart","Let me see that! [Takes the restraining order and wipes the mustard off him, then gives it back to SpongeBob] Thank you! Look, boy, I don't know what in coral cabins what a restraining order is, but I do know whatever's going on here clearly ain't working. Now I want this ship sailing smoothly! On the double! Or I'll be forced to remove more gold stars from your employee performance chart! [Takes away a star from SpongeBob's Employee Chart]",09,31,Restraining SpongeBob,2-Apr-12,10
25429,SpongeBob," Think, SpongeBob, think! Gasp! I got it!",screams,"[screams] Think, SpongeBob, think! Gasp! I got it!",09,31,Restraining SpongeBob,2-Apr-12,10
25430,Patrick, Hehe.,Giggling and moves closer and closer to Squidward,[Giggling and moves closer and closer to Squidward] Hehe.,09,31,Restraining SpongeBob,2-Apr-12,10
25431,Squidward," Oh, if I ignore it, maybe it will go away.",Reading a book,"[Reading a book] Oh, if I ignore it, maybe it will go away.",09,31,Restraining SpongeBob,2-Apr-12,10
25432,Patrick, Hehe.,Still giggling,[Still giggling] Hehe.,09,31,Restraining SpongeBob,2-Apr-12,10
25433,Squidward,I thought not  Oh-kay Patrick. What? What? What!,Closes the book,I thought not [Closes the book] Oh-kay Patrick. What? What? What!,09,31,Restraining SpongeBob,2-Apr-12,10
25434,Patrick, Notice anything...  Different? Huh? Huh? A hint! ,Still giggling Smacks Squidward's noise with the Krusty Krab hat he is wearing Takes out a drawing held upside-down of the Krusty Krab hat pointing to it and his hat,[Still giggling] Notice anything... [Smacks Squidward's noise with the Krusty Krab hat he is wearing] Different? Huh? Huh? A hint! [Takes out a drawing held upside-down of the Krusty Krab hat pointing to it and his hat],09,31,Restraining SpongeBob,2-Apr-12,10
25435,Mr. Krabs,Patrick! I am not not paying you to stand around and play guess what the idiot's thinking with Squidward! Get back to work!,,Patrick! I am not not paying you to stand around and play guess what the idiot's thinking with Squidward! Get back to work!,09,31,Restraining SpongeBob,2-Apr-12,10
25436,Squidward,"Yeah, Patrick! Get back to...what? Work? Oh no! No! No! No! Krabs!  Mr. Krabs!",Walks past SpongeBob who moves backwards then forwards,"Yeah, Patrick! Get back to...what? Work? Oh no! No! No! No! Krabs! [Walks past SpongeBob who moves backwards then forwards] Mr. Krabs!",09,31,Restraining SpongeBob,2-Apr-12,10
25437,Mr. Krabs,"Why all the shivering of the timbers, Mr. Squidward?",,"Why all the shivering of the timbers, Mr. Squidward?",09,31,Restraining SpongeBob,2-Apr-12,10
25438,Squidward,Mr. Krabs! This will not stand!,,Mr. Krabs! This will not stand!,09,31,Restraining SpongeBob,2-Apr-12,10
25439,Mr. Krabs,"It'll stand. Oh, unless you'd rather talk with SpongeBob.",,"It'll stand. Oh, unless you'd rather talk with SpongeBob.",09,31,Restraining SpongeBob,2-Apr-12,10
25440,Squidward,What?,,What?,09,31,Restraining SpongeBob,2-Apr-12,10
25441,Patrick,Can I watch you work?,,Can I watch you work?,09,31,Restraining SpongeBob,2-Apr-12,10
25442,Squidward,No.,,No.,09,31,Restraining SpongeBob,2-Apr-12,10
25443,Patrick,Please? .,"This line is repeated several more times, as Squidward gets fed up with Patrick asking","Please? [This line is repeated several more times, as Squidward gets fed up with Patrick asking].",09,31,Restraining SpongeBob,2-Apr-12,10
25444,Squidward,No!,,No!,09,31,Restraining SpongeBob,2-Apr-12,10
25445,Patrick,Pretty please?,,Pretty please?,09,31,Restraining SpongeBob,2-Apr-12,10
25446,Squidward,No! No! No! No!   Go away Patrick! Go away Patrick! Patrick! Patrick! Patrick!  Patrick!   Patrick!  Patrick!  Patrick!  Patrick! ,growls Patrick continues to follow him Washes hands and Patrick appears in the mirror Patrick touches his hat Pushes button on cash register and Patrick appears Starts walking with Patrick closely following him behind Using the restroom with Patrick beside him Starts sweating and shivering with Mr. Krabs now beside him,No! No! No! No! [growls] [Patrick continues to follow him] Go away Patrick! Go away Patrick! Patrick! Patrick! Patrick! [Washes hands and Patrick appears in the mirror] Patrick! [Patrick touches his hat]  Patrick! [Pushes button on cash register and Patrick appears] Patrick! [Starts walking with Patrick closely following him behind] Patrick! [Using the restroom with Patrick beside him] Patrick! [Starts sweating and shivering with Mr. Krabs now beside him],09,31,Restraining SpongeBob,2-Apr-12,10
25447,Mr. Krabs,Mr. Squidward...,,Mr. Squidward...,09,31,Restraining SpongeBob,2-Apr-12,10
25448,Squidward,,screams,[screams],09,31,Restraining SpongeBob,2-Apr-12,10
25449,Mr. Krabs,Time for your break. ,Walks off,Time for your break. [Walks off],09,31,Restraining SpongeBob,2-Apr-12,10
25450,Squidward,Ah...don't mind if I do.  Ah...no better way to spend a break then with a little cool jazz.  Huh?,Sits down Takes out the box that holds his clarinet and tries to play it but it isn't there,Ah...don't mind if I do. [Sits down] Ah...no better way to spend a break then with a little cool jazz. [Takes out the box that holds his clarinet and tries to play it but it isn't there] Huh?,09,31,Restraining SpongeBob,2-Apr-12,10
25451,Patrick, Hi Squidward!,Comes out of the restroom,[Comes out of the restroom] Hi Squidward!,09,31,Restraining SpongeBob,2-Apr-12,10
25452,Squidward,Hello...you...,,Hello...you...,09,31,Restraining SpongeBob,2-Apr-12,10
25453,Patrick,I just finished cleaning the restroom!,,I just finished cleaning the restroom!,09,31,Restraining SpongeBob,2-Apr-12,10
25454,Squidward, Ooh...that's great...,Sarcastically,[Sarcastically] Ooh...that's great...,09,31,Restraining SpongeBob,2-Apr-12,10
25455,Patrick,I mopped the floors! I shined the mirrors! I scrubbed the sinks.,,I mopped the floors! I shined the mirrors! I scrubbed the sinks.,09,31,Restraining SpongeBob,2-Apr-12,10
25456,Squidward, Wonderful.,Sarcastically,[Sarcastically] Wonderful.,09,31,Restraining SpongeBob,2-Apr-12,10
25457,Patrick,Oh yeah!  But we are going to need a new toilet plunger. This one's broken.,Takes out Squidward's clarinet that is soaking wet,Oh yeah! [Takes out Squidward's clarinet that is soaking wet] But we are going to need a new toilet plunger. This one's broken.,09,31,Restraining SpongeBob,2-Apr-12,10
25458,Squidward,Patrick! ,Takes back the clarinet and growls at Patrick which Mr. Krabs appears to see what is happening,Patrick! [Takes back the clarinet and growls at Patrick which Mr. Krabs appears to see what is happening],09,31,Restraining SpongeBob,2-Apr-12,10
25459,Mr. Krabs,"Nice work, Patrick! Break time's over, Mr. Squidward.",,"Nice work, Patrick! Break time's over, Mr. Squidward.",09,31,Restraining SpongeBob,2-Apr-12,10
25460,Squidward, Welcome to the House of Misery. May I take your order...,Walks over to a customer,[Walks over to a customer] Welcome to the House of Misery. May I take your order...,09,31,Restraining SpongeBob,2-Apr-12,10
25461,Dave,"Yes, I would like two Double Fried Kelp Fritters, three Krusty Krab Cream Filled Corals, and four Triple Fatty Krabby Patties. Is that too much?",,"Yes, I would like two Double Fried Kelp Fritters, three Krusty Krab Cream Filled Corals, and four Triple Fatty Krabby Patties. Is that too much?",09,31,Restraining SpongeBob,2-Apr-12,10
25462,Squidward,That depends...,,That depends...,09,31,Restraining SpongeBob,2-Apr-12,10
25463,Dave,On what?,,On what?,09,31,Restraining SpongeBob,2-Apr-12,10
25464,Squidward,How long you want to live? ,Laughs and walks right into Patrick,How long you want to live? [Laughs and walks right into Patrick],09,31,Restraining SpongeBob,2-Apr-12,10
25465,Patrick," Hah hah! Squidward's funny!  Hey, a button!",Laughs as Squidward's nose is stuck in is mouth. Squidward tries hard to get his nose free and he does but goes flying in the process Looks down and picks up something,"[Laughs as Squidward's nose is stuck in is mouth. Squidward tries hard to get his nose free and he does but goes flying in the process] Hah hah! Squidward's funny! [Looks down and picks up something] Hey, a button!",09,31,Restraining SpongeBob,2-Apr-12,10
25466,Gus," Oh, Grammy, I brought your favorite; seaberry pie.  Yikes! ",Comes in holding a pie Notices Squidward flying toward him Runs away,"[Comes in holding a pie] Oh, Grammy, I brought your favorite; seaberry pie. [Notices Squidward flying toward him] Yikes! [Runs away]",09,31,Restraining SpongeBob,2-Apr-12,10
25467,Squidward, Seaberries? I'm allergic to... Seaberries...That's it! I know what I must do!  SpongeBob!,Crashes into the seaberry pie and then onto the window. Then tastes the pie Body and face puff up Starts walking toward SpongeBob,[Crashes into the seaberry pie and then onto the window. Then tastes the pie] Seaberries? I'm allergic to...[Body and face puff up] Seaberries...That's it! I know what I must do! [Starts walking toward SpongeBob] SpongeBob!,09,31,Restraining SpongeBob,2-Apr-12,10
25468,Patrick,You're the prettiest button I've ev...  Huh? Monster!,Spots Squidward,You're the prettiest button I've ev... [Spots Squidward] Huh? Monster!,09,31,Restraining SpongeBob,2-Apr-12,10
25469,Squidward,SpongeBob!,,SpongeBob!,09,31,Restraining SpongeBob,2-Apr-12,10
25470,Patrick,"It's after SpongeBob!  You're right, button! No monster is going to eat our friend! ",Pause and looks at the button Jumps up high and yells; heads toward Squidward,"It's after SpongeBob! [Pause and looks at the button] You're right, button! No monster is going to eat our friend! [Jumps up high and yells; heads toward Squidward]",09,31,Restraining SpongeBob,2-Apr-12,10
25471,Squidward,"No, no no no wait!",,"No, no no no wait!",09,31,Restraining SpongeBob,2-Apr-12,10
25472,SpongeBob,"Oh no! My two best friends are fighting!  But this restraining order says I can't get close enough to break it off!  I'm sorry, restraining order! But my friends need me!  Stop!",Takes out restraining order Watches as Squidward squirts mustard at Patrick's face and Patrick then hits him with a spatula. They both continue to roll around and fight Screams and dives toward Squidward and Patrick and breaks up the fighting,"Oh no! My two best friends are fighting! [Takes out restraining order] But this restraining order says I can't get close enough to break it off! [Watches as Squidward squirts mustard at Patrick's face and Patrick then hits him with a spatula. They both continue to roll around and fight] I'm sorry, restraining order! But my friends need me! [Screams and dives toward Squidward and Patrick and breaks up the fighting] Stop!",09,31,Restraining SpongeBob,2-Apr-12,10
25473,Squidward, Give me that restraining order!,Notices the restraining order in SpongeBob's pocket and takes it,[Notices the restraining order in SpongeBob's pocket and takes it] Give me that restraining order!,09,31,Restraining SpongeBob,2-Apr-12,10
25474,SpongeBob,,screams,[screams],09,31,Restraining SpongeBob,2-Apr-12,10
25475,Squidward,"Alright, right, let's look at this.",,"Alright, right, let's look at this.",09,31,Restraining SpongeBob,2-Apr-12,10
25476,SpongeBob,"Squidward, please don't send me to jail!",,"Squidward, please don't send me to jail!",09,31,Restraining SpongeBob,2-Apr-12,10
25477,Patrick," Squidward?  Did you know the monster was Squidward? Well, when were you going to tell me?",Confused Looks at his button,"[Confused] Squidward? [Looks at his button] Did you know the monster was Squidward? Well, when were you going to tell me?",09,31,Restraining SpongeBob,2-Apr-12,10
25478,SpongeBob, I violated the restraining order! I'm sorry! I'm sorry!,Starts crying,[Starts crying] I violated the restraining order! I'm sorry! I'm sorry!,09,31,Restraining SpongeBob,2-Apr-12,10
25479,Squidward,Quit bellyaching and hand me a pen.,,Quit bellyaching and hand me a pen.,09,31,Restraining SpongeBob,2-Apr-12,10
25480,SpongeBob, Here you go. ,Cries Hands him a pen then continues crying,[Cries] Here you go. [Hands him a pen then continues crying],09,31,Restraining SpongeBob,2-Apr-12,10
25481,Squidward,Stop the waterworks! You're not going to jail.,,Stop the waterworks! You're not going to jail.,09,31,Restraining SpongeBob,2-Apr-12,10
25482,SpongeBob,I'm not? ,stops crying,I'm not? [stops crying],09,31,Restraining SpongeBob,2-Apr-12,10
25483,Squidward,No! I'm releasing you from this order. ,Crosses out SpongeBob's name on the restraining order,No! I'm releasing you from this order. [Crosses out SpongeBob's name on the restraining order],09,31,Restraining SpongeBob,2-Apr-12,10
25484,SpongeBob,"Really, Squidward?",,"Really, Squidward?",09,31,Restraining SpongeBob,2-Apr-12,10
25485,Squidward,...And adding someone who is much more deserving!,,...And adding someone who is much more deserving!,09,31,Restraining SpongeBob,2-Apr-12,10
25486,Patrick,"Sorry, button.",,"Sorry, button.",09,31,Restraining SpongeBob,2-Apr-12,10
25487,Squidward,"No, Patrick! You! ","Shows the restraining order with ""Patrick Star"" now written on it","No, Patrick! You! [Shows the restraining order with ""Patrick Star"" now written on it]",09,31,Restraining SpongeBob,2-Apr-12,10
25488,Patrick,Oh! Ah hah hah hah hah!,,Oh! Ah hah hah hah hah!,09,31,Restraining SpongeBob,2-Apr-12,10
25788,SpongeBob,"♪Mop, mop, mop, mop, mopping, mopping, mopping, mopping, mopping mopping!♪",,"♪Mop, mop, mop, mop, mopping, mopping, mopping, mopping, mopping mopping!♪",09,36,InSPONGEiac,9-Apr-12,10
25789,Squidward,SpongeBob!  Why don't you mop your way over the kitchen.  We need another Krabby Patty.,Frank comes in and brings him a dollar points at Frank,SpongeBob! [Frank comes in and brings him a dollar] Why don't you mop your way over the kitchen. [points at Frank] We need another Krabby Patty.,09,36,InSPONGEiac,9-Apr-12,10
25790,SpongeBob,Sure thing. ,SpongeBob walks to make a Krabby Patty. He puts a patty in a half made Krabby Patty and he puts too much mustard on it. Mr. Krabs opens the hot shelter and smells he that he put on too much mustard,Sure thing. [SpongeBob walks to make a Krabby Patty. He puts a patty in a half made Krabby Patty and he puts too much mustard on it. Mr. Krabs opens the hot shelter and smells he that he put on too much mustard],09,36,InSPONGEiac,9-Apr-12,10
25791,Mr. Krabs,What's that?,,What's that?,09,36,InSPONGEiac,9-Apr-12,10
25792,SpongeBob, Perfection. ,puts on the last bun Mr. Krabs walks to see SpongeBob,[puts on the last bun] Perfection. [Mr. Krabs walks to see SpongeBob],09,36,InSPONGEiac,9-Apr-12,10
25793,Mr. Krabs,I don't think so.  You used too much mustard!,grabs the Krabby Patty and sees too much mustard. Mr. Krabs gets angry at SpongeBob,I don't think so. [grabs the Krabby Patty and sees too much mustard. Mr. Krabs gets angry at SpongeBob] You used too much mustard!,09,36,InSPONGEiac,9-Apr-12,10
25794,SpongeBob,"But, Mr. Krabs, I...",,"But, Mr. Krabs, I...",09,36,InSPONGEiac,9-Apr-12,10
25795,Mr. Krabs,"You obviously you didn't use your hydraulic mustard gauge.  You think mustard grows from seeds?  Oh, at this rate, I'll be broke in  411 years!",Mr. Krabs uses a spoon and scoops some mustard. The spoon reads 101%. Mr Krabs gasps in shock throws the spoon and Krabby Patty away types the list,"You obviously you didn't use your hydraulic mustard gauge. [Mr. Krabs uses a spoon and scoops some mustard. The spoon reads 101%. Mr Krabs gasps in shock] You think mustard grows from seeds? [throws the spoon and Krabby Patty away] Oh, at this rate, I'll be broke in [types the list] 411 years!",09,36,InSPONGEiac,9-Apr-12,10
25796,SpongeBob,Really?,,Really?,09,36,InSPONGEiac,9-Apr-12,10
25797,Mr. Krabs,"Your skills are rusty, you're not your usual sharp self! Did you have breakfast this morning?",,"Your skills are rusty, you're not your usual sharp self! Did you have breakfast this morning?",09,36,InSPONGEiac,9-Apr-12,10
25798,SpongeBob,"Yes, I had a cup of sea kelp and a Neptune muffin.",,"Yes, I had a cup of sea kelp and a Neptune muffin.",09,36,InSPONGEiac,9-Apr-12,10
25799,Mr. Krabs,"Hmm... well, what about sleep, young man? Did you get enough sleep?",,"Hmm... well, what about sleep, young man? Did you get enough sleep?",09,36,InSPONGEiac,9-Apr-12,10
25800,SpongeBob,I did go to bed 2 minutes later than usual.,,I did go to bed 2 minutes later than usual.,09,36,InSPONGEiac,9-Apr-12,10
25801,Mr. Krabs, That's it!  You're an insomniac!,looks at SpongeBob pokes SpongeBob's body,[looks at SpongeBob] That's it! [pokes SpongeBob's body] You're an insomniac!,09,36,InSPONGEiac,9-Apr-12,10
25802,SpongeBob,An insomni-wha?,,An insomni-wha?,09,36,InSPONGEiac,9-Apr-12,10
25803,Mr. Krabs,"You're a person who can't sleep and if you can't get enough sleep, your mind starts to go!  Here.  Come on, now, cook!  Ha! Ha ha! I knew it! You lifted a patty from one side, instead of straight up! What are you trying to do, sabotage me?!  Now you go home and get some rest!",SpongeBob is surprised Gives SpongeBob the spatula and pushes him to the grill SpongeBob starts to flip patties. He pauses and glances at Mr. Krabs before flipping the patty. Mr. Krabs stops him takes the spatula and shoves him outside,"You're a person who can't sleep and if you can't get enough sleep, your mind starts to go! [SpongeBob is surprised] Here. [Gives SpongeBob the spatula and pushes him to the grill] Come on, now, cook! [SpongeBob starts to flip patties. He pauses and glances at Mr. Krabs before flipping the patty. Mr. Krabs stops him] Ha! Ha ha! I knew it! You lifted a patty from one side, instead of straight up! What are you trying to do, sabotage me?! [takes the spatula and shoves him outside] Now you go home and get some rest!",09,36,InSPONGEiac,9-Apr-12,10
25804,SpongeBob,"Oh, but, sir, I can't miss work at the Krusty Krab.",,"Oh, but, sir, I can't miss work at the Krusty Krab.",09,36,InSPONGEiac,9-Apr-12,10
25805,Mr. Krabs,"Miss work? If you keep making mistakes like that, boyo, there will be no Krusty Krab!",,"Miss work? If you keep making mistakes like that, boyo, there will be no Krusty Krab!",09,36,InSPONGEiac,9-Apr-12,10
25806,SpongeBob,No Krusty Krab?,,No Krusty Krab?,09,36,InSPONGEiac,9-Apr-12,10
25807,Mr. Krabs,"That's right!  Now, get!",points at the road,"That's right! [points at the road] Now, get!",09,36,InSPONGEiac,9-Apr-12,10
25808,SpongeBob," Yes, sir.",walks down the road,"[walks down the road] Yes, sir.",09,36,InSPONGEiac,9-Apr-12,10
25809,Mr. Krabs,Come back first thing tomorrow after a good night's sleep! ,Cut to SpongeBob's pineapple,Come back first thing tomorrow after a good night's sleep! [Cut to SpongeBob's pineapple],09,36,InSPONGEiac,9-Apr-12,10
25810,SpongeBob,"I just don't get it, Gary. I don't usually have a problem sleeping, do I?",,"I just don't get it, Gary. I don't usually have a problem sleeping, do I?",09,36,InSPONGEiac,9-Apr-12,10
25811,Gary,,Chews his snail food,[Chews his snail food],09,36,InSPONGEiac,9-Apr-12,10
25812,SpongeBob,"Well, I am not going to allow a mistake like today's to happen again. I am going straight to bed! ",Cut to SpongeBob's bed.,"Well, I am not going to allow a mistake like today's to happen again. I am going straight to bed! [Cut to SpongeBob's bed.]",09,36,InSPONGEiac,9-Apr-12,10
25813,SpongeBob,This pillow is hard as a rock! What to do?,,This pillow is hard as a rock! What to do?,09,36,InSPONGEiac,9-Apr-12,10
25814,Gary,Meow meow meow meow.,,Meow meow meow meow.,09,36,InSPONGEiac,9-Apr-12,10
25815,SpongeBob,"You're right, Gary! Warm milk puts me right to sleep.  Now, that should do the trick!",drinks it,"You're right, Gary! Warm milk puts me right to sleep. [drinks it] Now, that should do the trick!",09,36,InSPONGEiac,9-Apr-12,10
25816,SpongeBob," Boy, it sure is quiet around here. Only 5 hours until I go to work. C'mon SpongeBob, you can do this. 4 hours 59 minutes 50 seconds, 4 hours 59 minutes 45 seconds, 4 hours 59 minutes 41 seconds!  What if I don't get to sleep at all?  Ohhh, Mr. Krabs was right!  I am an insomniac. What am I gonna do? (speaking) I need some help.  Patrick, Patrick, wake up. ",Milk pours out of SpongeBob's holes SpongeBob throws the clock away in thoughts Camera goes on SpongeBob's eyes SpongeBob runs to Patrick's SpongeBob pulls Patrick up,"[Milk pours out of SpongeBob's holes] Boy, it sure is quiet around here. Only 5 hours until I go to work. C'mon SpongeBob, you can do this. 4 hours 59 minutes 50 seconds, 4 hours 59 minutes 45 seconds, 4 hours 59 minutes 41 seconds! [SpongeBob throws the clock away] What if I don't get to sleep at all? [in thoughts] Ohhh, Mr. Krabs was right! [Camera goes on SpongeBob's eyes] I am an insomniac. What am I gonna do? (speaking) I need some help. [SpongeBob runs to Patrick's] Patrick, Patrick, wake up. [SpongeBob pulls Patrick up]",09,36,InSPONGEiac,9-Apr-12,10
25817,Patrick,"Uh-huh.  Mmmm, sponge cake. ",SpongeBob is speaking gibberish Chews on SpongeBob's hand,"Uh-huh. [SpongeBob is speaking gibberish] Mmmm, sponge cake. [Chews on SpongeBob's hand]",09,36,InSPONGEiac,9-Apr-12,10
25818,SpongeBob,"Oh, yuck! Never mind that, Patrick! I need your help, desperately! I'm a insomniac! I need to sleep!",,"Oh, yuck! Never mind that, Patrick! I need your help, desperately! I'm a insomniac! I need to sleep!",09,36,InSPONGEiac,9-Apr-12,10
25819,Patrick,"Say no more, buddy. I know just the thing!  Get comfy!","Takes a deep breath, blows off the sand, and grabs a book","Say no more, buddy. I know just the thing! [Takes a deep breath, blows off the sand, and grabs a book] Get comfy!",09,36,InSPONGEiac,9-Apr-12,10
25820,SpongeBob,"Oh, boy! A bedtime story! ",Pulls up the sand into a pillow and lays down,"Oh, boy! A bedtime story! [Pulls up the sand into a pillow and lays down]",09,36,InSPONGEiac,9-Apr-12,10
25821,Patrick,"Okay. Once upon a time, there was a sleepy little boy.",,"Okay. Once upon a time, there was a sleepy little boy.",09,36,InSPONGEiac,9-Apr-12,10
25822,SpongeBob,"Ah, yay!",,"Ah, yay!",09,36,InSPONGEiac,9-Apr-12,10
25823,Patrick,The sleepy boy was the sleepiest boy in all the kingdom!,,The sleepy boy was the sleepiest boy in all the kingdom!,09,36,InSPONGEiac,9-Apr-12,10
25824,SpongeBob,"Mm, sounds like me.",,"Mm, sounds like me.",09,36,InSPONGEiac,9-Apr-12,10
25825,Patrick,"One night, he nestled into bed for a long slumber.",,"One night, he nestled into bed for a long slumber.",09,36,InSPONGEiac,9-Apr-12,10
25826,SpongeBob,Slumber!,,Slumber!,09,36,InSPONGEiac,9-Apr-12,10
25827,Patrick,"And Sir Cecil, the sea sleep king, sprinkled him with mystical sleepy dust.",,"And Sir Cecil, the sea sleep king, sprinkled him with mystical sleepy dust.",09,36,InSPONGEiac,9-Apr-12,10
25828,SpongeBob,"Aw, thank you, Sir Cecil.",,"Aw, thank you, Sir Cecil.",09,36,InSPONGEiac,9-Apr-12,10
25829,Patrick,"He couldn't have been cozier. When, without warning,  an excitable sea troll burst through the window. ""Wakey-wakey, sleepy-doo!"", he bellowed. Then suddenly he was whisked away by eagle-winged mollusks into the night sky!",raises voice,"He couldn't have been cozier. When, without warning, [raises voice] an excitable sea troll burst through the window. ""Wakey-wakey, sleepy-doo!"", he bellowed. Then suddenly he was whisked away by eagle-winged mollusks into the night sky!",09,36,InSPONGEiac,9-Apr-12,10
25830,SpongeBob,"Patrick, what are you doing? And what kind of a bedtime story was that, anyway?",,"Patrick, what are you doing? And what kind of a bedtime story was that, anyway?",09,36,InSPONGEiac,9-Apr-12,10
25831,Patrick,"It's called The Land of Perpetual Excitement. You know, it's a ""get out of bed"" story!",,"It's called The Land of Perpetual Excitement. You know, it's a ""get out of bed"" story!",09,36,InSPONGEiac,9-Apr-12,10
25832,SpongeBob,"Patrick, I'm trying to go to sleep.",,"Patrick, I'm trying to go to sleep.",09,36,InSPONGEiac,9-Apr-12,10
