id,speaker,speech,context,raw-dialouge,season,episode,title,airdate,runtime
6917,Squidward,Go away! I've got better things to do than watch grown men prance around in ridiculous outfits.  ...what? Circuit must've blown again. ,"Squidward's TV shows a man in a leotard performing ballet; the TV unexpectedly turns off opens door, letting the wind ruin his living room. SpongeBob and Patrick are also swept inside","Go away! I've got better things to do than watch grown men prance around in ridiculous outfits. [Squidward's TV shows a man in a leotard performing ballet; the TV unexpectedly turns off] ...what? Circuit must've blown again. [opens door, letting the wind ruin his living room. SpongeBob and Patrick are also swept inside]",09,15,Mermaid Man Begins,23-Sep-11,10
6918,SpongeBob,"Hey, thanks for letting us in, Squidward.",,"Hey, thanks for letting us in, Squidward.",09,15,Mermaid Man Begins,23-Sep-11,10
6919,Patrick,"Yeah, we owe you one!  What now, SpongeBob?",Squidward's house is also ripped apart by the wind and is hurled into the air,"Yeah, we owe you one! [Squidward's house is also ripped apart by the wind and is hurled into the air] What now, SpongeBob?",09,15,Mermaid Man Begins,23-Sep-11,10
6920,SpongeBob,"I don't know, Patrick. All the TVs in Bikini Bottom are knocked out! We have to find a secure place, some place that can survive this whirlwind.  Hey, that's it. If we want to see Mermaid Man and Barnacle Boy's origin, we'll just go to the source. Follow me, Patrick.",thinking,"I don't know, Patrick. All the TVs in Bikini Bottom are knocked out! We have to find a secure place, some place that can survive this whirlwind. [thinking] Hey, that's it. If we want to see Mermaid Man and Barnacle Boy's origin, we'll just go to the source. Follow me, Patrick.",09,15,Mermaid Man Begins,23-Sep-11,10
6921,Patrick,"Thanks for nothing, Squidward. ","he follows SpongeBob, who is leaving","Thanks for nothing, Squidward. [he follows SpongeBob, who is leaving]",09,15,Mermaid Man Begins,23-Sep-11,10
6922,Squidward,So sorry to have put such a wrinkle in your plans! ,He screams as he is flung into the air,So sorry to have put such a wrinkle in your plans! [He screams as he is flung into the air],09,15,Mermaid Man Begins,23-Sep-11,10
6923,SpongeBob," We made it!  Patrick, get up! We have found the Mermalair! ","both are grunting because they are crawling sees a welcome mat in front of the Mermalair secret entrance they proceed, but plunge into a trapdoor underneath the mat. They plunge into a net and drop onto the ground","[both are grunting because they are crawling] We made it! [sees a welcome mat in front of the Mermalair secret entrance] Patrick, get up! We have found the Mermalair! [they proceed, but plunge into a trapdoor underneath the mat. They plunge into a net and drop onto the ground]",09,15,Mermaid Man Begins,23-Sep-11,10
6924,SpongeBob and Patrick, Again!,exchanging glances,[exchanging glances] Again!,09,15,Mermaid Man Begins,23-Sep-11,10
6925,Barnacle Boy," Oh, boy.",spotting the two on the ground,"[spotting the two on the ground] Oh, boy.",09,15,Mermaid Man Begins,23-Sep-11,10
6926,SpongeBob and Patrick, Again!,laughing as they are dragged by Mermaid Man to they main control panel of the Mermalair,[laughing as they are dragged by Mermaid Man to they main control panel of the Mermalair] Again!,09,15,Mermaid Man Begins,23-Sep-11,10
6927,Barnacle Boy,Do you mind telling us what you're doing here?,,Do you mind telling us what you're doing here?,09,15,Mermaid Man Begins,23-Sep-11,10
6928,Patrick,We wanna watch your TV!,,We wanna watch your TV!,09,15,Mermaid Man Begins,23-Sep-11,10
6929,Barnacle Boy,"I hate to break it to you kids, but you'll have to go somewhere else. Our power got knocked out in the storm.",,"I hate to break it to you kids, but you'll have to go somewhere else. Our power got knocked out in the storm.",09,15,Mermaid Man Begins,23-Sep-11,10
6930,Patrick,"But, but... now how will we ever learn about their secret ""gorinin""? ","he mispronounces ""origin""","But, but... now how will we ever learn about their secret ""gorinin""? [he mispronounces ""origin""]",09,15,Mermaid Man Begins,23-Sep-11,10
6931,SpongeBob,"Hang on a minute, Patrick, we've got Mermaid Man and Barnacle Boy standing right over here!",,"Hang on a minute, Patrick, we've got Mermaid Man and Barnacle Boy standing right over here!",09,15,Mermaid Man Begins,23-Sep-11,10
6932,Patrick,"...Yeah, so?",,"...Yeah, so?",09,15,Mermaid Man Begins,23-Sep-11,10
6933,SpongeBob,"So, if we want to hear their origin, why don't we just ask them?",,"So, if we want to hear their origin, why don't we just ask them?",09,15,Mermaid Man Begins,23-Sep-11,10
6934,Patrick,Whoa! You're like a brain professor!,,Whoa! You're like a brain professor!,09,15,Mermaid Man Begins,23-Sep-11,10
6935,SpongeBob,"Mermaid Man, Barnacle Boy, we wanna know how this all started.",,"Mermaid Man, Barnacle Boy, we wanna know how this all started.",09,15,Mermaid Man Begins,23-Sep-11,10
6936,Mermaid Man,"You wanna go back to the start of it all, eh? Well, you see, in the beginning, it was all dark. And then all of a sudden, an event called The Big Splash formed the seas, and-",,"You wanna go back to the start of it all, eh? Well, you see, in the beginning, it was all dark. And then all of a sudden, an event called The Big Splash formed the seas, and-",09,15,Mermaid Man Begins,23-Sep-11,10
6937,Barnacle Boy,"Not the beginning of time, Mermaid-Brain. They want to know how we became a crime-fighting duo.",,"Not the beginning of time, Mermaid-Brain. They want to know how we became a crime-fighting duo.",09,15,Mermaid Man Begins,23-Sep-11,10
6938,Mermaid Man,"Oh... right.  Well, it all started when I was just a young, handsome muscular lad,  when suddenly, I noticed that my washing machine had stopped. ","thinking A flashback begins, showing a young, handsome Mermaid Man surfing and eating a submarine sandwich Mermaid Man of the flashback grabs the clothes out of the washing machine on the beach","Oh... right. [thinking] Well, it all started when I was just a young, handsome muscular lad, [A flashback begins, showing a young, handsome Mermaid Man surfing and eating a submarine sandwich] when suddenly, I noticed that my washing machine had stopped. [Mermaid Man of the flashback grabs the clothes out of the washing machine on the beach]",09,15,Mermaid Man Begins,23-Sep-11,10
6939,Barnacle Boy,What are you talking about? ,flashback ends,What are you talking about? [flashback ends],09,15,Mermaid Man Begins,23-Sep-11,10
6940,Mermaid Man,Huh?,,Huh?,09,15,Mermaid Man Begins,23-Sep-11,10
6941,Barnacle Boy,You're supposed to be telling the story of how we became superheroes!,,You're supposed to be telling the story of how we became superheroes!,09,15,Mermaid Man Begins,23-Sep-11,10
6942,Mermaid Man," ...The story. Yes. I was a young, handsome muscular lad, soaking up the sun's rays on the beach,  when suddenly, I became drowsy.  A wave came ashore, and drew me back into the ocean!  Suddenly, I realized I was being sucked under by a violent whirlpool! I was running out of oxygen fast.  But before I drowned, I was rescued by mermaids.  They took me to the ocean floor, where they gave me a magic sea star that allowed me to breathe underwater. ","facepalms a new flashback begins, very similar to the first one Mermaid Man in the flashback falls asleep instantly waves draw Mermaid Man in the flashback into the sea, he is drowning, and he yells ""Help!"" while coughing Mermaid Man in the flashback sinks to the bottom of the sea and gives up trying the struggle Mermaid Man in the flashback is carried through the ocean by two mermaids Mermaid Man in the flashback inhales and exhales deeply, then falls asleep, the present Mermaid Man falls asleep also","[facepalms] ...The story. Yes. I was a young, handsome muscular lad, soaking up the sun's rays on the beach, [a new flashback begins, very similar to the first one] when suddenly, I became drowsy. [Mermaid Man in the flashback falls asleep instantly] A wave came ashore, and drew me back into the ocean! [waves draw Mermaid Man in the flashback into the sea, he is drowning, and he yells ""Help!"" while coughing] Suddenly, I realized I was being sucked under by a violent whirlpool! I was running out of oxygen fast. [Mermaid Man in the flashback sinks to the bottom of the sea and gives up trying the struggle] But before I drowned, I was rescued by mermaids. [Mermaid Man in the flashback is carried through the ocean by two mermaids] They took me to the ocean floor, where they gave me a magic sea star that allowed me to breathe underwater. [Mermaid Man in the flashback inhales and exhales deeply, then falls asleep, the present Mermaid Man falls asleep also]",09,15,Mermaid Man Begins,23-Sep-11,10
6943,Barnacle Boy,"Wake up, you old coot. Finish the story.",,"Wake up, you old coot. Finish the story.",09,15,Mermaid Man Begins,23-Sep-11,10
6944,Mermaid Man, Huh?,wakes up after being nudged by Barnacle Boy,[wakes up after being nudged by Barnacle Boy] Huh?,09,15,Mermaid Man Begins,23-Sep-11,10
6945,SpongeBob," Yeah, Mermaid Man, what about Barnacle Boy?",excitedly,"[excitedly] Yeah, Mermaid Man, what about Barnacle Boy?",09,15,Mermaid Man Begins,23-Sep-11,10
6946,Patrick,"Yeah, how'd you two meet?",,"Yeah, how'd you two meet?",09,15,Mermaid Man Begins,23-Sep-11,10
6947,Mermaid Man," Oh, sorry, boys... There I was in the ocean, the only human who could breathe underwater.  Alas, such a life got lonely real fast; I had no other humans to talk to. What was a man to do? Then my question was answered. ","slapping his temples flashback resumes the bottom of a ship is seen in the flashback, then the port side of the ship is shown, where a very young Barnacle Boy is scraping barnacles off the wood. The captain of the ship appears","[slapping his temples] Oh, sorry, boys... There I was in the ocean, the only human who could breathe underwater. [flashback resumes] Alas, such a life got lonely real fast; I had no other humans to talk to. What was a man to do? Then my question was answered. [the bottom of a ship is seen in the flashback, then the port side of the ship is shown, where a very young Barnacle Boy is scraping barnacles off the wood. The captain of the ship appears]",09,15,Mermaid Man Begins,23-Sep-11,10
6948,Captain,"Hey, barnacle boy, make sure you scrape the barnacles underneath, too.",,"Hey, barnacle boy, make sure you scrape the barnacles underneath, too.",09,15,Mermaid Man Begins,23-Sep-11,10
6949,Young Barnacle Boy,"Aye, aye. ",he takes a deep breath and lowers himself underwater to get the barnacles under the surface,"Aye, aye. [he takes a deep breath and lowers himself underwater to get the barnacles under the surface]",09,15,Mermaid Man Begins,23-Sep-11,10
6950,Flashback Mermaid Man,"A boy in trouble! I've got to act fast or he'll drown.  Fear not, young man. I'll take care of this.",he swims to Barnacle Boy,"A boy in trouble! I've got to act fast or he'll drown. [he swims to Barnacle Boy] Fear not, young man. I'll take care of this.",09,15,Mermaid Man Begins,23-Sep-11,10
6951,Mermaid Man," I used my new telekinetic powers to draw barnacles into Barnacle Boy's body, where they took the place of his lungs so he could breathe underwater, too. It was at that moment when we decided to team up.",narrating once again,"[narrating once again] I used my new telekinetic powers to draw barnacles into Barnacle Boy's body, where they took the place of his lungs so he could breathe underwater, too. It was at that moment when we decided to team up.",09,15,Mermaid Man Begins,23-Sep-11,10
6952,SpongeBob," Ohhhh, so that's how you guys got together.",the flashback has ended,"[the flashback has ended] Ohhhh, so that's how you guys got together.",09,15,Mermaid Man Begins,23-Sep-11,10
6953,Barnacle Boy,"No, no, no...  The reason I teamed up with this joker is because I was stuck breathing underwater for the rest of my life.",shaking head and crossing arms,"No, no, no... [shaking head and crossing arms] The reason I teamed up with this joker is because I was stuck breathing underwater for the rest of my life.",09,15,Mermaid Man Begins,23-Sep-11,10
6954,Mermaid Man,Oh... yeah.,,Oh... yeah.,09,15,Mermaid Man Begins,23-Sep-11,10
6955,Barnacle Boy,"Anyway, from that day forward, we became",,"Anyway, from that day forward, we became",09,15,Mermaid Man Begins,23-Sep-11,10
6956,Johnny,"Mermaid Man and Barnacle Boy, superhero crime fighters!",,"Mermaid Man and Barnacle Boy, superhero crime fighters!",09,15,Mermaid Man Begins,23-Sep-11,10
6957,Flashback Mermaid Man and Barnacle Boy, A crime in progress! ,"new flashback begins, an alarm is clanging while people are shouting A bank robber laughs maniacally as he is stealing bags of cash from the First Nautical Bank","[new flashback begins, an alarm is clanging while people are shouting] A crime in progress! [A bank robber laughs maniacally as he is stealing bags of cash from the First Nautical Bank]",09,15,Mermaid Man Begins,23-Sep-11,10
6958,Banker,Stop! Thief!,,Stop! Thief!,09,15,Mermaid Man Begins,23-Sep-11,10
6959,Flashback Barnacle Boy,"See if you think this is funny, evildoer.  Who's laughing now, thieving scum?","He rapidly spits barnacles at the robber, knocking him down","See if you think this is funny, evildoer. [He rapidly spits barnacles at the robber, knocking him down] Who's laughing now, thieving scum?",09,15,Mermaid Man Begins,23-Sep-11,10
6960,Banker," Thank you, sir. And to whom do I owe this debt of gratitude?",shaking Mermaid Man's hand,"[shaking Mermaid Man's hand] Thank you, sir. And to whom do I owe this debt of gratitude?",09,15,Mermaid Man Begins,23-Sep-11,10
6961,Flashback Mermaid Man,"You can thank me, Mermaid Man. ",Barnacle Boy is seen shaking in indignity in the background,"You can thank me, Mermaid Man. [Barnacle Boy is seen shaking in indignity in the background]",09,15,Mermaid Man Begins,23-Sep-11,10
6962,Man Ray, You're mine!,"new flashback begins, Man Ray has the upper hand in a duel against Barnacle Boy. He laughs","[new flashback begins, Man Ray has the upper hand in a duel against Barnacle Boy. He laughs] You're mine!",09,15,Mermaid Man Begins,23-Sep-11,10
6963,Flashback Barnacle Boy," How'd you like to taste my tentacle zapper, Man Ray?",shoots web a web of cheese-like material that binds and gags Man Ray,"[shoots web a web of cheese-like material that binds and gags Man Ray] How'd you like to taste my tentacle zapper, Man Ray?",09,15,Mermaid Man Begins,23-Sep-11,10
6964,Flashback Mermaid Man," Hello...  So? What are you wearing?  Oh. In that case, can I get a large pepperoni pizza, extra cheese? Thanks. ",dialing a pay phone indistinct response indistinct response Barnacle Boy slaps his head in disgust,"[dialing a pay phone] Hello... [indistinct response] So? What are you wearing? [indistinct response] Oh. In that case, can I get a large pepperoni pizza, extra cheese? Thanks. [Barnacle Boy slaps his head in disgust]",09,15,Mermaid Man Begins,23-Sep-11,10
6965,Mermaid Man, That didn't happen!,flashback has ended,[flashback has ended] That didn't happen!,09,15,Mermaid Man Begins,23-Sep-11,10
6966,Barnacle Boy,"Oh, yes, it did!",,"Oh, yes, it did!",09,15,Mermaid Man Begins,23-Sep-11,10
6967,Mermaid Man,"Oh no, it didn't!",,"Oh no, it didn't!",09,15,Mermaid Man Begins,23-Sep-11,10
6968,Barnacle Boy,"Oh, ha ha, like you remember. You don't even remember where you live.",,"Oh, ha ha, like you remember. You don't even remember where you live.",09,15,Mermaid Man Begins,23-Sep-11,10
6969,Mermaid Man,It didn't happen!,,It didn't happen!,09,15,Mermaid Man Begins,23-Sep-11,10
6970,Johnny," And now, without any further delays, the Mermaid Man and Barnacle Boy Origin Episode.",the Mermalair's large TV suddenly turns on,"[the Mermalair's large TV suddenly turns on] And now, without any further delays, the Mermaid Man and Barnacle Boy Origin Episode.",09,15,Mermaid Man Begins,23-Sep-11,10
6971,SpongeBob," Oh, this is it!",standing up excitedly,"[standing up excitedly] Oh, this is it!",09,15,Mermaid Man Begins,23-Sep-11,10
6972,Johnny,The story of Mermaid Man and Barnacle Boy all started here. ,The TV zooms in on a series of red apartment buildings,The story of Mermaid Man and Barnacle Boy all started here. [The TV zooms in on a series of red apartment buildings],09,15,Mermaid Man Begins,23-Sep-11,10
6973,Tim," Come on, Ernie! The movie's about to start... Where's the popcorn?","Barnacle Boy is now a young adult dressed in a white t-shirt and jeans, in front of the television sitting on a couch","[Barnacle Boy is now a young adult dressed in a white t-shirt and jeans, in front of the television sitting on a couch] Come on, Ernie! The movie's about to start... Where's the popcorn?",09,15,Mermaid Man Begins,23-Sep-11,10
6974,Ernie," It's in the microwave, Tim.",Mermaid Man is now a young adult dressed in a striped shirt and khakis. He is waiting next to the microwave in the kitchen,"[Mermaid Man is now a young adult dressed in a striped shirt and khakis. He is waiting next to the microwave in the kitchen] It's in the microwave, Tim.",09,15,Mermaid Man Begins,23-Sep-11,10
6975,Johnny," At that very moment in the apartment directly above, a rogue scientist doing tests on radioactive ants knocks over a jar of his infected specimens, one of which, without any hesitation, crawls down one floor and miraculously lands undetected. It viciously bites our soon-to-be superhero. He screams in pain,...",talking very rapidly as the scene he is describing unfolds as he is talking,"[talking very rapidly as the scene he is describing unfolds as he is talking] At that very moment in the apartment directly above, a rogue scientist doing tests on radioactive ants knocks over a jar of his infected specimens, one of which, without any hesitation, crawls down one floor and miraculously lands undetected. It viciously bites our soon-to-be superhero. He screams in pain,...",09,15,Mermaid Man Begins,23-Sep-11,10
6976,Ernie,Ahh!,,Ahh!,09,15,Mermaid Man Begins,23-Sep-11,10
6977,Johnny,...stumbling backwards.,,...stumbling backwards.,09,15,Mermaid Man Begins,23-Sep-11,10
6978,Tim,What on earth?,,What on earth?,09,15,Mermaid Man Begins,23-Sep-11,10
6979,Johnny,"In a split-second, both men find themselves in a freefall that sends them squarely through the roof of a vats of acid factory, and into a vat of acid that is tipped over by an errant alien spaceship, carrying the two blindly on a wave of acid during a solar eclipse on a leap year, precariously careening onto a bomb-testing site, where a cataclysmic explosion exposes our heroes in waiting to highly toxic radium gases. Then, as fate would have it, magical storm clouds move in, zapping both men with a neon-plaid lightning bolt and raining radioactive ooze, which, through centrifugal and electromagnetic turbulence, causes a powerful earthquake deep in the jungle two-thousand miles away, consequently unearthing a magical crystal with wings that flies to Ernie and Tim's exact location, and, powered by super gamma energy currents, pilots them to open skies until, not paying attention, the crystal clips the top of a billboard, flinging the two back to their apartment miraculously unharmed, when... ",microwave beeps,"In a split-second, both men find themselves in a freefall that sends them squarely through the roof of a vats of acid factory, and into a vat of acid that is tipped over by an errant alien spaceship, carrying the two blindly on a wave of acid during a solar eclipse on a leap year, precariously careening onto a bomb-testing site, where a cataclysmic explosion exposes our heroes in waiting to highly toxic radium gases. Then, as fate would have it, magical storm clouds move in, zapping both men with a neon-plaid lightning bolt and raining radioactive ooze, which, through centrifugal and electromagnetic turbulence, causes a powerful earthquake deep in the jungle two-thousand miles away, consequently unearthing a magical crystal with wings that flies to Ernie and Tim's exact location, and, powered by super gamma energy currents, pilots them to open skies until, not paying attention, the crystal clips the top of a billboard, flinging the two back to their apartment miraculously unharmed, when... [microwave beeps]",09,15,Mermaid Man Begins,23-Sep-11,10
6980,Ernie,"Hey, the popcorn's ready!",,"Hey, the popcorn's ready!",09,15,Mermaid Man Begins,23-Sep-11,10
6981,Johnny,...they proceed with movie night and eat slightly overcooked popcorn.,,...they proceed with movie night and eat slightly overcooked popcorn.,09,15,Mermaid Man Begins,23-Sep-11,10
6982,Tim,Mmmm... I think you overcooked this a little.,,Mmmm... I think you overcooked this a little.,09,15,Mermaid Man Begins,23-Sep-11,10
6983,Johnny,"Suddenly, an amazing reaction to the overcooked popcorn hits them with a jolt of cosmic super energy, metamorphosing Ernie into an incredibly strong, seastar-wearing superhero and Tim into a slightly less strong, but also super sailor-looking guy.",,"Suddenly, an amazing reaction to the overcooked popcorn hits them with a jolt of cosmic super energy, metamorphosing Ernie into an incredibly strong, seastar-wearing superhero and Tim into a slightly less strong, but also super sailor-looking guy.",09,15,Mermaid Man Begins,23-Sep-11,10
6984,Tim,I have the sudden and incredibly urge to breathe water instead of air.,,I have the sudden and incredibly urge to breathe water instead of air.,09,15,Mermaid Man Begins,23-Sep-11,10
6985,Ernie,As do I.,,As do I.,09,15,Mermaid Man Begins,23-Sep-11,10
6986,Johnny,And that is how they became the superheroes we have come to know as...  Mermaid Man and Barnacle Boy: Defenders of the Deep! ,the heroes dive into the ocean from a dock and pose The End graphic appears on the TV,And that is how they became the superheroes we have come to know as... [the heroes dive into the ocean from a dock and pose] Mermaid Man and Barnacle Boy: Defenders of the Deep! [The End graphic appears on the TV],09,15,Mermaid Man Begins,23-Sep-11,10
6987,Barnacle Boy,"Oh, feels just like yesterday, doesn't it, Mermaid Man?",,"Oh, feels just like yesterday, doesn't it, Mermaid Man?",09,15,Mermaid Man Begins,23-Sep-11,10
6988,Mermaid Man,"...No, not really.",,"...No, not really.",09,15,Mermaid Man Begins,23-Sep-11,10
6989,Barnacle Boy,"Hmm... Oh, so what do you boys think? Boys? ",realizes SpongeBob and Patrick have left,"Hmm... Oh, so what do you boys think? Boys? [realizes SpongeBob and Patrick have left]",09,15,Mermaid Man Begins,23-Sep-11,10
6990,SpongeBob," Okay, Patrick, the overcooked popcorn will be ready in twelve minutes!",programming microwave for 12 minutes,"[programming microwave for 12 minutes] Okay, Patrick, the overcooked popcorn will be ready in twelve minutes!",09,15,Mermaid Man Begins,23-Sep-11,10
6991,Patrick,This is gonna be so super awesome!,,This is gonna be so super awesome!,09,15,Mermaid Man Begins,23-Sep-11,10
6992,SpongeBob,So superhero awesome!,,So superhero awesome!,09,15,Mermaid Man Begins,23-Sep-11,10
6993,Mermaid Man and Barnacle Boy,No! Stop! But you're not superhero material! Look at those shoes! ,Mermaid Man and Barnacle Boy keep on blabbering until the episode ends,No! Stop! But you're not superhero material! Look at those shoes! [Mermaid Man and Barnacle Boy keep on blabbering until the episode ends],09,15,Mermaid Man Begins,23-Sep-11,10
7641,Mr. Krabs,Who's ready for some excitement?,,Who's ready for some excitement?,09,22,Mr. Krabs Takes a Vacation,9-Nov-11,10
7642,"SpongeBob, Patrick, Sandy, and Pearl",We are! ,Squidward is sitting idly by,We are! [Squidward is sitting idly by],09,22,Mr. Krabs Takes a Vacation,9-Nov-11,10
7643,Mr. Krabs,Who is ready for some fun?,,Who is ready for some fun?,09,22,Mr. Krabs Takes a Vacation,9-Nov-11,10
7644,SpongeBob and Patrick,We are!,,We are!,09,22,Mr. Krabs Takes a Vacation,9-Nov-11,10
7645,Mr. Krabs,Who's ready to look at some vacation pictures?,,Who's ready to look at some vacation pictures?,09,22,Mr. Krabs Takes a Vacation,9-Nov-11,10
7646,Patrick and Sandy,We... huh?,,We... huh?,09,22,Mr. Krabs Takes a Vacation,9-Nov-11,10
7647,Mr. Krabs, I'm sure you know this charming fellow!  Here's the one that almost got away!  Look at these pile towers of golden green!  Here's how the whole thing started! ,turns off lights and turns on a slideshow and turns it to a picture of a dollar changes slide to him catching money changes slide to a pile of money changes slide to the Krusty Krab cuts to flashback,[turns off lights and turns on a slideshow and turns it to a picture of a dollar] I'm sure you know this charming fellow! [changes slide to him catching money] Here's the one that almost got away! [changes slide to a pile of money] Look at these pile towers of golden green! [changes slide to the Krusty Krab] Here's how the whole thing started! [cuts to flashback],09,22,Mr. Krabs Takes a Vacation,9-Nov-11,10
7648,Squidward,"That will be $6.75, please. ",Takes money from the customer,"That will be $6.75, please. [Takes money from the customer]",09,22,Mr. Krabs Takes a Vacation,9-Nov-11,10
7649,Mr. Krabs," Attention! Attention, all employees of the Krusty Krab! Report immediately to the main office!",on a loud speaker,"[on a loud speaker] Attention! Attention, all employees of the Krusty Krab! Report immediately to the main office!",09,22,Mr. Krabs Takes a Vacation,9-Nov-11,10
7650,Squidward,,walks off,[walks off],09,22,Mr. Krabs Takes a Vacation,9-Nov-11,10
7651,Frankie Billy,Hey! What about my change?,,Hey! What about my change?,09,22,Mr. Krabs Takes a Vacation,9-Nov-11,10
7652,SpongeBob, You called Mr. Krabs?,Appears from the door to Mr. Krabs' office,[Appears from the door to Mr. Krabs' office] You called Mr. Krabs?,09,22,Mr. Krabs Takes a Vacation,9-Nov-11,10
